,FRASE,OBJ/SUBJ
1171," uma gangue de ladrões aparece em paris , roubando bancos e joalherias com uma velocidade incrível .  ",objetiva
1172," não só graças a essas cenas bizarras , a magnum opus da escritora austríaca elfriede jelinek nas mãos da dupla de diretores kelly camo e paola li afã se transforma em um peculiar filme de terror mudo de 8mm , que consegue combinar habilmente o misterioso com o grotesco .  ",objetiva
1173,bally é uma garota de dez anos completamente normal . ,objetiva
1174,e uma paixão ardente pode ajudá-lo muito em sua busca . ,objetiva
1175," um evento de prestígio em number foi um convite para um show de joe cocker , que nunca tem convidados ou fronte em seus shows .  ",objetiva
1176,a primeira aventura animada de scooby-doo está chegando aos nossos cinemas e promete ser um grande espetáculo ! ,objetiva
1177, seus pesadelos absurdos cheios de crueldade e humor negro revelam um interesse no clássico ' film noir ' e na escola bruta e criam uma imagem cética e elegantemente esculpida da existência humana .  ,objetiva
1178," as duas meninas tornam-se amigas e alimentam uma à outra o ódio aos ricos patrões de sophie , sua educação , uma certa superioridade e sofisticação .  ",objetiva
1179," o comissário da juventus , juntamente com o jornalista andor , continuam a processar xantomas .  ",objetiva
1180," chang chen-wai , um especialista em artes marciais , administra um negócio de importação .  ",objetiva
1181," através de seus próprios esforços e perseverança , ela gradualmente enriqueceu e agora volta a visitar como milionária .  ",objetiva
1182," no entanto , nossa moderna safo não percebe quão tragicamente a história da antiga safo terminou ?  ",objetiva
1183,o ídolo da atuação de seu tempo poderia usar plenamente seu potencial cômico e dramático aqui . ,objetiva
1184," o ponto de partida do filme é o fato de que durante uma conversa comum com chouto é possível aprender toda uma série de histórias e anedotas , que , como descobrimos mais tarde , todas existem em forma escrita e já foram codificadas pelo autor .  ",objetiva
1185," graças à sua inteligência , ele consegue evitar as armadilhas da polícia e , graças aos subornos , até os políticos o protegem .  ",objetiva
1186," imediatam en te depois , ocorre a maquinaria do marketing político profissional , que visa ' produzir ' um novo presidente .  ",objetiva
1187," mas à medida que a noite se aprofunda , eles descobrem os horrores que existem dentro de sua antiga mansão vitoriana .  ",objetiva
1188,diviso és imperiais e revolucionárias colidem em uma batalha feroz . ,objetiva
1189," com boa saúde , eles chegam à ilha onde reside o clã de takeda , mas é apenas uma questão de tempo até que finjo e seus assassinos apareçam lá também .  ",objetiva
1190,ela decide que nunca mais quer ter colegas de quarto . ,objetiva
1191," o filme para televisão em duas partes foi criado de acordo com o tema e roteiro do experiente casal de autores lucide e josef cona a , o diretor é bisar a . archote .  ",objetiva
1192,então taylor sugere que todos que estão incomodados com verdade e mentiras devem se unir e lutar contra ele juntos . ,objetiva
1193," uma comédia cinematográfica cubana contemporânea sobre uma troca de apartamentos complicada sem precedentes , que é tão complicada que nem mesmo seus participantes a entendem .  ",objetiva
1194,vis it aremos lugares da boêmia que influenciaram a história do design e complementaremos o filme com músicas que apoiarão períodos individuais e as dramáticas mudanças político-sociais - históricas que influenciaram o desenvolvimento do design . ,objetiva
1195," este termo reúne uma geração de jovens cineastas de autor alemães atuantes nas décadas de number e number e que priorizar a crítica em seus filmes , ou seja , o confronto da sociedade e da política contemporâneas .  ",objetiva
1196,deve - se notar que a nível mundial . ,objetiva
1197,ela será capaz de resolver o mistério criminal inesperado ? ,objetiva
1198," matt , que tem que lidar sozinho com a informação sobre a desconexão de sua esposa , decide trazer alex do dormitório .  ",objetiva
1199,uma mulher e um policial obscuro tentam detê-lo antes que ele possa alcançar a criança e transmitir a maldição . ,objetiva
1200,gilliam também é obcecado por suas namoradas índigo e célere . ,objetiva
1201," embora a república tcheca seja um país livre da raiva , animais infectados aparecem de repente perto de uma das aldeias de fumava , e o personagem principal deste thriller criminal , o virologista pavel roel , na casa dos trinta , é encarregado de mapear a situação , supervisionar a vacinação e encontrar a causa da infecção .  ",objetiva
1202," para algumas pessoas , esse passatempo infantil nunca termina – e a equipe de demolição da asi shredding manager está se divertindo muito .  ",objetiva
1203,e então as coisas começam a acontecer como um filme de terror . ,objetiva
1204,o que eles eram e como seu terrível drama se desenrolou ? ,objetiva
1205,todo o enredo do filme é enriquecido por uma velhinha que manipula quase todos os personagens . ,objetiva
1206," nas décadas seguintes , aceitou generosas ofertas de todo o mundo e preparou projetos audiovisuais cada vez mais complexos ( actorscope , selecionada , cinelabyrinth ) .  ",objetiva
1207,hoje en ary blefa ( tim allen ) era um grande comediante e um arqueiro ainda maior . ,objetiva
1208," mas anthony está longe do que parece e uma vez que sua verdadeira identidade seja revelada , é bem possível que ele possa influenciar a vida dos outros .  ",objetiva
1209,ambos têm uma ideia clara de como tornar a vida mais agradável . ,objetiva
1210,mas os médicos legistas encontram uma morte precoce e cruel . ,objetiva
1211," a repressão contra estudantes universitários , incluindo prisões generalizadas , deportações e execuções , continua sendo um forte lembrete para todas as democracias que não estão dispostas a defender um espaço livre para a educação e o desenvolvimento de sua geração jovem .  ",objetiva
1212,o principal diretor europeu lars von von é um dos fundadores do manifesto dinamarquês dogma number . ,objetiva
1213,bela é uma médium e pode sentir espíritos . ,objetiva
1214,mas de onde veio cesso e por quanto tempo matizada pode manter seu relacionamento seguro ? ,objetiva
1215," eu o segui e , com a ajuda do meu amuleto da sorte , ele arruinou os cavalheiros do cassino .  ",objetiva
1216," o mundo hoje não quer pensar , quer se divertir .  ",objetiva
1217," tudo começou há number milhões de anos , quando parte do continente se separou da áfrica .  ",objetiva
1218," no entanto , david está determinado a recuperar sua reputação e respeito próprio em um esporte que estagnou sua promissora carreira de ator .  ",objetiva
1219," na época , foi o filme mais caro da história .  ",objetiva
1220," mau it o em breve , eles não estão apenas no encalço de seu empregador gângster , mas também do chefe do departamento de detetives da polícia de nova york , hackman , e da policial baile , que é bonita , mas também implacável e , além disso , claramente tem seus próprios planos . com um par de meninos espertos .  ",objetiva
1221,ele então forneceu ao casal seus primeiros carros de corrida . ,objetiva
1222," o filme ganhou merecido uma indicação ao oscar de melhor roteiro original , não apenas pela narrativa precisamente estruturada , mas também por sua atualidade : através da história de johnny e seus dois companheiros da força aérea naval , reflete as dificuldades enfrentadas pela guerra veteranos após o retorno da guerra .  ",objetiva
1223," mau it os tentaram encontrá-lo , mas ninguém conseguiu .  ",objetiva
1224," não en hum deles nunca se importou muito com ela , e estava claro que não seria melhor desta vez também .  ",objetiva
1225," semelhante ao seu videoclipe provavelmente mais famoso , sabotagem , aqui os faroeste boys parodiam filmes do passado de uma maneira extremamente divertida .  ",objetiva
1226,o filme realmente mostra satiricamente a vida de michael nos últimos anos . ,objetiva
1227," as crianças não fazem ideia de que ela é esposa de um homem ligado à máfia , que mais tarde marcará tragicamente seus destinos .  ",objetiva
1228," dois cadetes seduzem duas meninas do instituto , mas não querem assumir a responsabilidade .  ",objetiva
1229,um dos episódios da série popeye the bailar . ,objetiva
1230,john está feliz por não ter que voltar para casa . ,objetiva
1231," no entanto , a situação do modelo é encenada muito em primeira mão , com as performances dos atores desnecessariamente tensas .  ",objetiva
1232," eva en atual en te , o carrossel retorcido imaginário não pode ser interrompido e o crepúsculo da civilização humana parece inevitável .  ",objetiva
1233," olhando para o rosto ensanguentado dos mortos desconhecidos , taylor , chocada , percebe que está olhando para seu sósia ingere perfeito .  ",objetiva
1234,um grande grupo de colonos brancos planeja fazer um breve teste com chat e seguir seu rastro no território apache . ,objetiva
1235,o documentário é um exemplo da abordagem antropológica da filmagem que também é característica dos filmes posteriores de esposar . ,objetiva
1236," o serviço de segurança russo posteriormente o prendeu e o acusou , entre outras coisas , de preparar ataques terroristas .  ",objetiva
1237,michael suspeita que o senhor . petar foi assassinado . ,objetiva
1238,ela e seu amigo park coe jung vão se casar . ,objetiva
1239," - uma história simples e satírica da filha de um rico fazendeiro - paulina , que se recusa a cumprir o desejo de seus pais de se casar com um nobre empobrecido e foge de casa para encontrar seu amado japim , a quem ela escolheu como seu parceiro de vida .  ",objetiva
1240, a super-heroína local ' strange juice ' enfrentará os terroristas .  ,objetiva
1241," seu povo não aprova muito a chegada do vaqueiro , especialmente ele é uma pedra no sapato do capataz pinky , o amante rejeitado da atraente esposa do fazendeiro , mãe .  ",objetiva
1242,unida de sim aéreas rebeldes devem usar isso para atacar a estrela da morte e destruir suas fontes de energia . ,objetiva
1243,ela não quer que os homens a toquem . ,objetiva
1244," em number , nas ilhas achatam , o advogado americano adam swing testemunha a flagelação de um escravo , atui , enquanto lidava com um contrato comercial para seu sogro .  ",objetiva
1245," ele está apenas aceitando a morte de seu parceiro de longa data , jim .  ",objetiva
1246," mas quando o carneiro boris se junta a eles e encanta os dois meninos à sua maneira , as primeiras rachaduras aparecem em sua longa amizade .  ",objetiva
1247," ele nos leva para seus quartos , latrinas , cozinhas e estábulos .  ",objetiva
1248," em uma pequena cidade dinamarquesa , martin , de number anos , está se preparando para a confirmação , que o transformará de menino em homem .  ",objetiva
1249," em janeiro de number , a máquina de guerra japonesa estava atacando todo o sudeste asiático .  ",objetiva
1250,um curta-metragem que natali fez no mesmo ano que seu filme muito mais famoso bosta . ,objetiva
1251,babys it ting acaba por ser a melhor solução . ,objetiva
1252," conserva-o en te de sua morte iminente , ele embarca em uma jornada para encontrar todos que amava e que significavam algo em sua vida .  ",objetiva
1253,isso é exatamente o que acontece com lucy quando seu eu do futuro começa a enviar mensagens de texto dando conselhos sobre como lidar com a vida . ,objetiva
1254," então linde vai para baltimore sozinha , enquanto ben vai para a flórida com seus amigos que são tão obcecados pelos red box quanto ele .  ",objetiva
1255," a história de várias camadas se concentra no destino do espião russo alexander balo , que , sob o codinome johann weiss , chega ao centro da abater .  ",objetiva
1256,mas chama ainda ouve sua voz interior e tenta ligar para sua família para se despedir . ,objetiva
1257," o filme utiliza princípios cadenciais da arte poética , dança moderna , figurinos altamente estilizados e procedimentos estéticos da arte .  ",objetiva
1258," este é o mais recente escândalo de engenharia genética , ou é uma benção e salvação para os campos ocupados da medicina e da agricultura ?  ",objetiva
1259," el és estão , portanto , gradualmente tentando inocular todos os number com um inibidor , ou seja , uma substância que retarda a reação da neomicina .  ",objetiva
1260," ouça as histórias surpreendentes , quase inacreditáveis , mas ainda assim verdadeiras , de pessoas comuns cujas vidas se tornam desagradáveis ​​​​por uma superabundância de pragas .  ",objetiva
1261,o terror de rato mais famoso da oficina de bruno mattei . ,objetiva
1262," como deviam-na ama midi , ele se lança sem medo em batalhas com demônios que podem ameaçar seu amor e seu novo lar .  ",objetiva
1263," e , finalmente , hitler novamente , desta vez como pintor em algum lugar da américa do sul , nos braços de uma mulata , que ele pretende tomar como esposa no final de sua vida .  ",objetiva
1264,e assim ele se propõe a explorar o mercado local . ,objetiva
1265,danny é preso por agredir a polícia e tudo vai das dez às cinco . ,objetiva
1266," ele e ela se apaixonam à primeira vista , mas ambos querem algo diferente da vida .  ",objetiva
1267," enquanto a adolescente dora faz reuniões patrióticas e canta canções sobre rios há muito perdidos , o idoso serpeja desenterra seus ossos e secretamente sonha em mudar as circunstâncias .  ",objetiva
1268,mas ele está bem ciente da linha que não deve cruzar . ,objetiva
1269," a peça em si é sobre uma jornada dolorosa , cujo objetivo é devolver a princesa cachinhos dourados à sua beleza feminina - ela foi enfeitiçada pelo malvado gigante bolo já .  ",objetiva
1270,então as crianças não têm nada para semear o campo . ,objetiva
1271," colidi , um peão simpático e não repulsivo no grande mundo dos bandidos e ladrões , acaba de roubar uma igreja e embarcar em um trem com uma mala cheia de joias da igreja .  ",objetiva
1272," por necessidade , fanny se casa com a idosa banisse ( maurice chevalier ) .  ",objetiva
1273,o povo mexicano é muito grato a todos os pistoleiros . ,objetiva
1274,o homem é incapaz de distinguir entre realidade e fantasia e torna-se excessivamente confiante com sua aparente vitória . ,objetiva
1275,estrelando pétrea hřebíčková ( prêmio avalie number ) . ,objetiva
1276,o homem morre durante a viagem e ambas as partes decidem ficar com o dinheiro . ,objetiva
1277,o jovem gerard bearnês se destaca como ator aqui . ,objetiva
1278,o tio de rebello está ligado aos contrabandistas e tem a tarefa de eliminar cegar . ,objetiva
1279,el és são alguns dos assassinos mais capazes do reino animal . ,objetiva
1280," karen bip irá levá-lo através da noite final de gala em uma transmissão ao vivo , na qual os prêmios da televisão weekly de number serão entregues a personalidades populares da televisão .  ",objetiva
1281,o jovem d'artanyan está cheio de planos arrogantes para subjugar paris . ,objetiva
1282," no início deste período , um liceu nacional de elite foi estabelecido em minsk .  ",objetiva
1283," durante number shows , ela alcançou mais de number milhões de fãs com o álbum ' a head full of dramas ' .  ",objetiva
1284," virginia viaja para a índia para visitar amar , que vive em um manicômio há anos .  ",objetiva
1285," el és tiveram um caso de amor no sinai , como tantos outros que começam nas férias e depois terminam .  ",objetiva
1286," el és devem enfrentar os maiores guerreiros e heróis como sze-ma chao-chun chamado ' o invencível ' , seu ajudante e estrategista ernest tung-lai , seu inimigo de longa data chu menga e a misteriosa figura de um guerreiro com uma caixa de madeira em as costas dele .  ",objetiva
1287," histórias autênticas e realistas apresentadas com leveza e vivacidade da viena imperial , sob um novo ponto de vista e uma perspectiva inusitada .  ",objetiva
1288," enquanto explora as maravilhas do mundo mundano , ela conhece um menino mutante deslumbrante .  ",objetiva
1289,lá ele conhece jim michaelis e se torna muito próximo . ,objetiva
1290," ele encontra a alegria perdida , restaura seu relacionamento com seu filho e as feridas da morte de sua esposa se curam .  ",objetiva
1291,cume se transforma em um monstro e só pode retornar à forma humana se comer carne humana suficiente . ,objetiva
1292," o iídiche , o romana e o italiano também foram influentes .  ",objetiva
1293,ele logo encontra um novo lar com o doutor . carter ( cliff roberto ) e seu show de feira . ,objetiva
1294," de dia , louis bergamin é um respeitável proprietário de vastas garagens , mas à noite lidera uma gangue criminosa de fraudadores .  ",objetiva
1295," de és está forma , as frustrações mútuas são resolvidas e pode-se dizer que a assistência paga à vizinhança , antes normal e comum no campo , é efetivamente introduzida .  ",objetiva
1296," essas micro-histórias entrelaçadas estão conectadas pelo personagem do detetive durão de douglas , jim acúleo , um homem de ação explosivo com visões radicais que não tem o menor grau de empatia , mesmo por sua própria esposa .  ",objetiva
1297,o filme foi premiado com uma série de prêmios goya . ,objetiva
1298,acompanhe a narrativa da relação com as armas na perspectiva dos cidadãos americanos . ,objetiva
1299," afinal , ele tem uma clientela muito pouco convencional com exigências especiais em seu negócio .  ",objetiva
1300,as coisas pioram quando um carro para ao lado de sua cabana e doria e filipe testemunham vários assassinatos . ,objetiva
1301,aqui ele ajuda a polícia local a resolver crimes na comunidade russa . ,objetiva
1302," a albânia não é exatamente uma potência do futebol , mas isso não significa que não tenha algumas histórias de futebol convincentes .  ",objetiva
1303," mas já está chegando a seus sapatos , porque seu estoque de dinheiro em casa não era tão secreto quanto eles pensavam .  ",objetiva
1304," entre outras coisas , o autor conduz oficinas de animação para crianças , e a estética dos desenhos infantis se refletiu fundamentalmente no videoclipe .  ",objetiva
1305,da semente do desejo cresce o que nos alimentará . ,objetiva
1306,o primeiro filme espanhol de ferrari sobre a situação frustrante de um jovem casal apaixonado que não consegue encontrar um apartamento para morar . ,objetiva
1307," a comunicação do filho com a mãe , cheia de amor e amizade , contrasta nitidamente com a incapacidade de outros membros da família de passarem um curto período de tempo com a velha .  ",objetiva
1308," com eles , experimentamos o relacionamento dramático de dois seres diferentes com visões de vida e valores completamente diferentes .  ",objetiva
1309," jehovist encantamento : a testemunha de jeová , piam candelária , é morta em um assalto à casa e seu marido é brutalmente espancado .  ",objetiva
1310," ele quer fazer seus filhos , raul ( shahrukh khan ) e prima ( trance en a atando ) , se apaixonarem um pelo outro .  ",objetiva
1311,on de conseguir dinheiro para uma moradia digna ? ,objetiva
1312," jane ficou gravemente ferido e , após vários meses de inconsciência , acordou em uma cadeira de rodas .  ",objetiva
1313," após uma longa jornada repleta de conhecimento , o personagem finalmente encontra seu próprio rosto .  ",objetiva
1314," no entanto , os heróis do filme também devem garantir as condições básicas de sobrevivência .  ",objetiva
1315," há três anos , atui jubilo mudou-se para tóquio .  ",objetiva
1316," o filme expõe o poder da polícia , as possibilidades limitadas de assistência social nos eua e o número cada vez maior de mulheres sem-teto ( e não só ) em los angeles .  ",objetiva
1317," apo és ar de seu passado de guerra na eritrina e infância dolorosa , ele é um aluno , filho e atleta exemplar .  ",objetiva
1318,e então ele decide investigar o que exatamente aconteceu sete anos atrás . ,objetiva
1319,os anos de sabedoria e experiência de marta com denunciantes trarão equilíbrio e resolução ao conflito . ,objetiva
1320,este é um videoclipe da banda britânica de pop bonsai beat de seu álbum de estreia the age of consent . ,objetiva
1321,ele então experimenta seu primeiro amor e uma luta acima das nuvens em um grupo de pilotos de caça . ,objetiva
1322,um homem está preso na teia psicológica de duas mulheres que estão fugindo uma da outra e de seu passado . ,objetiva
1323," number . - cazaquistão , a encruzilhada da ásia central - o cazaquistão oferece um espetáculo único dos mais diversos cenários de natureza selvagem .  ",objetiva
1324," seu nome tornou-se sinônimo de romances tecnicamente perfeitos , nos quais o espectador está constantemente tenso e irresistivelmente atraído pela trama .  ",objetiva
1325,reflexo és de pessoas que demonstram a necessidade de repressão em nossa vida . ,objetiva
1326," no entanto , a humanidade não vai tolerar isso , então usa uma máquina do tempo para enviar voluntários entre os prisioneiros para o passado .  ",objetiva
1327," os pais dela não deveriam ter problemas criminais , mas sarah e richard poderiam processá-los .  ",objetiva
1328,as leis da natureza aqui ditam dois modos de vida radicalmente diferentes . ,objetiva
1329,a cidade de repente ganha vida e todos os seus habitantes estão se preparando para assistir à apresentação de seu famoso nativo . ,objetiva
1330," filmherbá ř constrói uma analogia entre botânica e cinema em uma sequência de imagens e reflexões emocionais , quando conecta a preservação e descrição de objetos naturais com a memória humana inscrita no material fílmico e o processo de seu resgate .  ",objetiva
1331," quando sua irmã desaparece enquanto trabalhava no grand hotel , o jovem aceita um emprego no hotel para desvendar o mistério .  ",objetiva
1332," acima de tudo , ela gostaria de um noivo rico para sua filha .  ",objetiva
1333," o filme acompanha bianca e finn , os dois personagens principais , enquanto aprendem as várias habilidades necessárias para serem guias de montanha e também superam os desafios que apresentam .  ",objetiva
1334,a vida no cinturão equatorial é incrivelmente variada . ,objetiva
1335," a comédia supervisionada pelos irmãos arregla road to high society , produzida por matt damon e ben affleck , é baseada em um curta-metragem dirigido por jason mann , que estreou no rapinante festival de londres em number .  ",objetiva
1336,a garota coreana gogo soo hee mora nos estados unidos . ,objetiva
1337,o filme experimental usa peças de computador recicladas para construir uma acrópole abstrata povoada por componentes eletrônicos . ,objetiva
1338,o roubo cuidadosamente preparado funciona como um relógio . ,objetiva
1339,mas a vida cotidiana na escola também não é fácil . ,objetiva
1340," agora ele está procurando os restos mortais , o flautista virá em vez de honda .  ",objetiva
1341,essa experiência a comove tanto que ela decide fugir . ,objetiva
1342," no momento em que eles testemunham um assassinato , mas tudo termina - seus planos , seus futuros e suas vidas .  ",objetiva
1343," na série , acompanhamos as histórias de quatro advogados famosos ( trota , nicholson , muller e graves ) , que são chamados para casos e casos que muitas vezes são fortemente assistidos pela mídia , e que tentam resolver em favor do cliente , mas nem sempre conseguem .  ",objetiva
1344," e foi essa banda que foi capturada em filme e assim preservada como um documento de arte popular , como uma confirmação da longevidade da arte musical em hora jack .  ",objetiva
1345," segundo a lenda , o povo de bremen tocou a campainha uma hora antes ao meio-dia daquele dia na igreja de petrosa , porque ficou sabendo da decisão de torstenson .  ",objetiva
1346," an de sim é misturado com cenas de fantasia e espirituais , além de uma forte mensagem humana .  ",objetiva
1347,é somente através de uma amizade com um dos alunos que linguiça é capaz de se redescobrir . ,objetiva
1348," el en a descobre que o jovem não é apenas um substituto de verão para ela , ele começa a se contorcer um pouco com o relacionamento e seu pai não é completamente cego , então tudo leva a um desenlace desagradável .  ",objetiva
1349," ashton kutcher , conhecido da série de televisão the wild ou dos filmes hey dedé , i've got a car e wedding in las vegas , prepara elaboradas pegadinhas canadenses para superstars como madonna , halle berry ou leonard o'neal e depois filma suas reações com uma câmera escondida .  ",objetiva
1350," me és amor que ele se junte a uma gangue , ele é incapaz de cometer más ações .  ",objetiva
1351,estava hackeando o regime comunista por seu dinheiro . ,objetiva
1352," com o seu filme , a realizadora eslovaca regressa à tecnologia tradicional da animação de telenovelas e apresenta uma nova perspetiva sobre um conto popular .  ",objetiva
1353," ambos cresceram em uma família mineira , e o próprio pepino vivenciou os momentos ansiosos e intermináveis ​​ de espera por ajuda em um desmoronamento .  ",objetiva
1354," um thriller sombrio com um herói fascinante e ambíguo dilacerado por raivas internas , é o título nacional mais premiado do ano passado .  ",objetiva
1355," um notório batedor de carteiras se apaixona por uma bela cantora síria , mas é pego e preso após uma tentativa fracassada de roubar uma idosa .  ",objetiva
