,FRASE,OBJ/SUBJ
2887,a viagem durou cinco dias e cinco noites e foi sem dúvida um acontecimento extraordinário para os passageiros . ,objetiva
2888,ele é a única pessoa viva que sabe a verdade sobre carter . ,objetiva
2889,a mudança na usina nuclear de fukushima pode literalmente lidar com os choques perfeitamente . ,objetiva
2890,isso inicia uma busca dramática por pistas vagas que levam ao passado . ,objetiva
2891," kevin , um menino que vive na idade média , chega à montanha do dragão depois de cair na água .  ",objetiva
2892,os colonizadores chegam a uma ilha intocada pela civilização ocidental . ,objetiva
2893,toda a aldeia e seus arredores são atormentados pela ganância do moleiro local ( de . hofmanová ) e do escriba do castelo ( aza . mary afã ) . ,objetiva
2894," o filme , oscilando entre o taciturno e o humor , atrai , entre outras coisas , a forte atuação de evocação misera .  ",objetiva
2895,marcai compra um anel e depois descobre que é mágico . ,objetiva
2896," e ele , da posição de sua posição , foi participante deles .  ",objetiva
2897," ele é um cientista talentoso e inventou um líquido , uma substância cujo efeito é muito estranho - rejuvenesce , mas ao mesmo tempo muda o caráter .  ",objetiva
2898,dois lutadores no esporte nacional da islândia e seu frágil caso de amor . ,objetiva
2899, o filme cult ' pink brown : the wall ' é um dos poucos filmes que experimentam material puramente musical .  ,objetiva
2900," no entanto , o ex-ator , que veste o traje de legionário romano todos os dias , não perde a esperança , vive no aqui e agora .  ",objetiva
2901," por curiosidade , em um impulso repentino , chino pergunta se useiro vai sair com ele .  ",objetiva
2902," juntam en te com seus amigos que não têm medo de nada , ele embarca em uma investigação e ainda não sabe que vero , sua própria filha , se tornou alvo de um perigoso oponente em paris .  ",objetiva
2903,filme soviético sobre a conferência econômica internacional que ocorreu em abril de number em moscou . ,objetiva
2904,plívová fala não só de si mesma e da direção . ,objetiva
2905," mas mesmo que ela pudesse fugir , ela está a quase number milhas de deserto longe de ajuda .  ",objetiva
2906,mas eles também gerenciam suas contas entre si . ,objetiva
2907," o mago krudsky roubou a luz mágica e se os dois heróis não o impedirem , todos eles se transformarão em monstros aterrorizantes .  ",objetiva
2908," por um infeliz acidente , um jovem vizinho ouve tudo e entra para ajudar o balconista .  ",objetiva
2909,est és são os heróis em que confiamos quando surge um perigo inesperado e real . ,objetiva
2910," a segunda tomada tem pouco mais de uma hora de duração , e todo o drama realmente acontece sem um único corte .  ",objetiva
2911," com a principal base da máfia internacional à vista , ele une forças com o ágil detetive local tony ( tony jaca ) .  ",objetiva
2912,parece que a humanidade finalmente alcançou uma verdadeira utopia . ,objetiva
2913," ela pode lidar com um trabalho que há muito era reservado para homens , mas acha difícil aceitar o fato de ter que trabalhar com uma jovem negra , anita king , na investigação .  ",objetiva
2914," torne - se membro de uma expedição de pesquisa e acompanhe o mistério do nascimento , morte e a luta pela sobrevivência em um filme evocativo que documenta o mundo animal .  ",objetiva
2915," além disso , joey ensinou às escoteiras uma boa estratégia de vendas , então as escoteiras logo começaram a ganhar muito dinheiro .  ",objetiva
2916," é uma homenagem à vontade que nunca pode ser superada , a vontade que permite aos supermães de alegado fazer o superman de alegado .  ",objetiva
2917," graças a uma conversa casual com um cliente , ela recebe uma oferta para um cargo no banco .  ",objetiva
2918," no tempo de nossa história , o amor entre backup e kamila se acende novamente , e sob se esforça para eliminar o perigoso fischer de mentalidade democrática .  ",objetiva
2919," interveio em quase todos os campos da criação artística , trabalhou também como ator , cantor , músico e dramaturgo ( osvoboz en é dicado na supri , teatro dada , modern studio ) , comentarista de rádio , poeta e artista .  ",objetiva
2920,o trabalho conjunto de um diretor europeu e iraniano busca respostas para uma das questões mais candentes do nosso tempo . ,objetiva
2921," christine tem problemas , como qualquer adolescente .  ",objetiva
2922," sobre uma velha - a última alma de uma antiga família nobre , que vive nas ruínas do castelo da família .  ",objetiva
2923," jongo não desiste e começa a investigar um caso antigo , após o que o computador de bordo maço number confessa a ela que matou seu dono de propósito .  ",objetiva
2924," afinal , ela não desfruta de muita paz em casa - sua mãe carinhosa e seu pai neurótico muitas vezes brigam e , após o súbito desaparecimento de sua irmã mais velha , o humor da família aumenta novamente .  ",objetiva
2925,el és saltam de um avião que passa com um pára-quedas . ,objetiva
2926,vamos mostrar-lhe a áfrica como ninguém viu antes . ,objetiva
2927,sua família e amigos assistem ansiosamente sáurio realizar esta cerimônia bizarra . ,objetiva
2928," a sétima parte da série cult serie dos anos number , dirigida pelo diretor de filmes bom john carl becker .  ",objetiva
2929,ele conecta quase todos os países e funciona number horas por dia . ,objetiva
2930," a banda , que está no fundo do poço , decide lançar um novo disco .  ",objetiva
2931," a trama , que se passa em algum momento do século number ou number de acordo com os temas dos contos de cavaleiros antigos , de uma vez por todas já esgotados na literatura , fala sobre uma linda filha de um príncipe , que é forçada pelo pai a se casar um homem não amado , sobre ladrões e a trágica morte de uma garota roubada sobre um cavaleiro branco , um modelo de coragem e cavalheirismo , como histórias históricas foram escritas em calendários há muitos anos .  ",objetiva
2932," no momento certo , no entanto , o resgate vem na forma de carmen - ela pede que eles venham para uma cidade remota no sul e façam um pequeno trabalho para ela por uma quantia interessante de dinheiro .  ",objetiva
2933,asir tem number anos e vive com sua mãe e irmãos em um campo de refugiados no meio do deserto argelino . ,objetiva
2934,esta série documental examina o assassinato de décadas da irmã catherine cernia e a suspeita de conexão com um padre acusado de abuso . ,objetiva
2935," no entanto , o interesse do patrocinador é que os membros do jovem casal compitam entre si .  ",objetiva
2936," a entrada principal para o jardim será a partir das antigas escadas do castelo , onde estava originalmente .  ",objetiva
2937," ambos então convencem o senhor . cão a mudar as células de caráter do pai de martin ( já . abriam ) , um contador pedante que não gosta de animais porque não cabem em seu orçamento ou apartamento .  ",objetiva
2938,pontiagudo parte ico animado evocando a atmosfera das antigas pinturas holandesas . ,objetiva
2939,a diversidade de personagens retratados por um conjunto de atores soberbamente composto mostra diferentes atitudes em relação aos eventos dramáticos na eslováquia no período após a repressão violenta da revolta nacional . ,objetiva
2940," enquanto tenta encontrar o caminho entre o labirinto de lojas e a correria de clientes , uma excitada mary espera na fila para ver o papai noel sob a supervisão de seus irmãos , a quem ela confia em seu colo o desejo de ter um milhão de dólares para seu pai para que ele não precise se preocupar .  ",objetiva
2941,ele construiu um telescópio incrível no jardim e tinha todos os tipos de planos para novas observações . ,objetiva
2942," mas agora na universidade , ele é um calouro comum , que quase todo mundo ignora e o considera um típico idiota e idiota .  ",objetiva
2943," o tiro veio da arma do jovem larry evans , então o xerife crasear tem uma ideia bastante clara do assassino .  ",objetiva
2944,ela estava ansiosa por ele até conhecer cindira . ,objetiva
2945," as músicas tocadas eram principalmente dos álbuns bonsai of the state , assim como dedé ranch e persa cat .  ",objetiva
2946," anta és que john perceba de onde vem o perigo , ergueria está no encalço de lee .  ",objetiva
2947," quando ela se apaixona por um oficial inimigo , ela escolhe entre a voz do seu coração e o dever .  ",objetiva
2948,o diretor sedan golubovi a chamou seu filme de versão balcânica de crime e castigo . ,objetiva
2949,o único filme simultaneamente de rouca e níger que já foi exibido na competição oficial do festival de cannes . ,objetiva
2950," el és relutantemente decidem enviar seus filhos - george , de oito anos , e selma , de cinco anos - para o exterior , onde estarão seguros .  ",objetiva
2951,mas isso é outra história . ,objetiva
2952," intelig en te , embora um pouco ned , cate trabalhava no pentágono como uma força administrativa , mas quando sua mãe morreu , ela se demitiu e , com o dinheiro que deixou , comprou um brechó não tão próspero de seu amigo mais velho william .  ",objetiva
2953," o filme imprense , filmado em colaboração com os cinegrafistas antonia ilhotas a e jia ai stalin , mostra um grupo de recrutas se despedindo de suas namoradas e pais , cantando , dançando e bebendo na estação principal de praga .  ",objetiva
2954," ao mesmo tempo , surge um novo mega tubarão que pode ameaçar a segurança global .  ",objetiva
2955,retrato televisivo do músico de jazz jia ai stalin . ,objetiva
2956,number franceses e um alemão viajam juntos pelo deserto . ,objetiva
2957,a garota braille vê uma raposa na floresta e quer fazer amizade com ela . ,objetiva
2958," portanto , não é de admirar que mitsuo leve sua vida muito difícil e sonhe com uma vida maravilhosa em uma cidade grande como tóquio .  ",objetiva
2959," el és , portanto , decidiram destruir todo o lugar onde guimba deveria renascer , mas , sem saber , falharam .  ",objetiva
2960," ou um membro local da célula comunista de resistência secreta ari a ( e . roman kim ) liderando uma disputa com o jovem carteiro reme a ( karalho . spin baku ) , cujas escapadas estúpidas ari a considera um anarquista .  ",objetiva
2961,outro ramo da família é hubert de madura e sua filha empe . ,objetiva
2962," além disso , fedi ainda está se recuperando do fim de um grande amor antigo .  ",objetiva
2963," então robinson sai por um ano , viaja em um navio mercante e é encarregado de manter o diário de bordo do navio .  ",objetiva
2964," tom e alex bennet se mudam para a casa onde o morador anterior , cameron , cometeu suicídio .  ",objetiva
2965," o filme foi concluído em uma versão de dez minutos para o curta-metragem de televisão laser e em uma versão de vinte e um minutos para a televisão da tchecoslováquia , onde foi exibido em janeiro de number .  ",objetiva
2966,pegadas enormes de um lagarto gigante desconhecido foram descobertas no panamá . ,objetiva
2967," ela ainda tem suas suspeitas , mas ela se junta a ele .  ",objetiva
2968," o filme , baseado na peça de aderence antiga de number , o príncipe adormecido ( checo sob o título joelho vasos sobre-a em number ) , trouxe para a tela dois atores proeminentes de seu tempo .  ",objetiva
2969," seu modus operando tornou-se violência , cooperação com o submundo e mentiras .  ",objetiva
2970," a adolescência , no entanto , também traz consigo os primeiros dilemas morais , testes de caráter , confrontos com a realidade cotidiana e a necessidade de tomar uma decisão , por exemplo , entre futebol e amigos e entre um relacionamento .  ",objetiva
2971,dois jovens casais vão em motos de neve para uma cabana nas montanhas para o fim de semana . ,objetiva
2972," essas pessoas dedicaram toda a sua vida à dança , mas a glória nem sempre os espera no final .  ",objetiva
2973,o filme é uma boa visão do pensamento contemporâneo e da realidade de moscou naquela época . ,objetiva
2974," o maciço , criado há number milhões de anos , tornou-se uma espécie de armadilha para animais e plantas a que tiveram de se adaptar .  ",objetiva
2975," uma adaptação lírico-melancólica altamente gráfica ( com diálogo mínimo ) do conto de cenho the entourage ( na mesma época , o diretor václav bed bicha fez um curta de animação com o artista jia ai aclamou e o narrador legislava pé reik como uma adaptação tcheca ) sobre um menino que se perde e é acolhido por um artista de circo representado por olé tabaco ( há também um caseiro , um gato e um chulice morando na casa com ele ) .  ",objetiva
2976,el és decidem trocar de parceiro com seus amigos americanos ( betty e mike ) e fazer um pequeno golpe para não precisarem deixar os eua . ,objetiva
2977,o caminho dos imigrantes que querem se estabelecer no arizona passa por um deserto perigoso chamado flano estacado . ,objetiva
2978," e assim , graças ao diretor de cinema bórico , podemos ver como o mundo moderno e elegante se funde com o mundo ' un de round ' em gore patinação .  ",objetiva
2979,transmissão ao vivo da premiação anual do livro magnésia alitera number do novo palco do teatro nacional de praga . a premiação do livro magnésia alitera está agora em seu décimo sexto ano procurando o melhor que as editoras tchecas publicaram no ano passado . ,objetiva
2980," como rei , governou ataca com prudência e sabedoria .  ",objetiva
2981," no entanto , em conexão com a crise na indústria automotiva , a empresa está tendo problemas .  ",objetiva
2982," a gravação de um concerto de duas bandas ciganas do palácio acrópoles de praga de number , organizado pelo semanário respect em conjunto com a agência racho , chama a atenção para o primeiro ano do festival internacional de música étnica , dedicado à exposição da cultura cigana , que reuniu vários grupos musicais ciganos de toda a europa .  ",objetiva
2983,e aqui está o principal objetivo do diretor - criar a imagem mais autêntica do canibalismo para que as pessoas no cinema vomitem ! ,objetiva
2984," no entanto , toda a história acaba bem no final e walt e simon encontram o caminho um para o outro .  ",objetiva
2985," quatro décadas depois , o filho de evito , don michael colecione ( del pacino ) , segura firmemente nas mãos as rédeas de um enorme império , que tenta expandir seu poder para além do território americano , resiste à tentativa das autoridades de restringir sua influência e negócios e , ao ao mesmo tempo luta impiedosamente contra traidores em suas próprias fileiras .  ",objetiva
2986," el és estão voltando às suas raízes para o verão , mas não fazem ideia de que estão transportando o primeiro imigrante ilegal para a argélia .  ",objetiva
2987," no entanto , a entrega oficial termina em fiasco , o governador , o chefe de polícia local e holmes encontram apenas o cadáver de um velho índio no cofre do prédio do governo em vez do valioso diamante .  ",objetiva
2988," ele conhece um desde a infância e o outro , uma mulher misteriosa , que conheceu no cemitério da cidade enquanto visitava o túmulo de sua falecida mãe .  ",objetiva
2989," em uma reunião de candidatos em uma mansão rural , doze participantes descobrem que se tornarão milionários se cumprirem três condições .  ",objetiva
2990,o concerto também foi lançado em cadê e dvd . ,objetiva
2991," claro , não é outro senão o ' hell ' sim maia café ' , onde os meninos se vestem como empregadas domésticas .  ",objetiva
2992,o filme estreou no sundae film festival e foi indicado ao globo de ouro . ,objetiva
2993,haley descarta tudo o que ela foi até aquele momento . ,objetiva
2994," no dia em que sua virgindade será leiloada , entre os visitantes da casa da fragrância está um jovem e inexperiente balconista que se apaixona por susan e gasta todas as suas economias em uma noite com ela .  ",objetiva
2995," a narração é de fato muito diversificada , pois corresponde à personagem da heroína titular , que gosta de se mover na fronteira da lei .  ",objetiva
2996,yang aprende gradualmente com an xis sua história de vida . ,objetiva
2997," enquanto caçam na floresta , vários caçadores americanos de fim de semana encontram alienígenas perigosos que estão em menor número , mais rápidos que os caçadores e ainda famintos .  ",objetiva
2998," na atmosfera amigável , mas ainda hospitalar , há um ponto de interrogação invisível .  ",objetiva
2999," foi então que logan jurou a si mesmo que , quando crescesse , rastrearia os assassinos e vingaria a morte de sua família .  ",objetiva
3000," reconstrução da vida e dos tempos de catarina ii , conhecida como catarina , a grande .  ",objetiva
3001,peque en as histórias que acontecem à beira do rio ajudarão a penetrar no cotidiano indígena em diferentes épocas . ,objetiva
3002," o programa documental de jane abo reik apresenta não apenas a história deste monumento e os antecedentes históricos de sua criação , mas também o método de restauração em cooperação com especialistas americanos que usaram a tecnologia mais moderna para seus trabalhos .  ",objetiva
3003," juntos , john e marcus devem viajar ao coração da keynes para resgatar um certo homem que está preso lá .  ",objetiva
3004,um urso pardo de três metros também quer seguir seu caminho e segue o grupo . ,objetiva
3005," naquele verão , o belo court foster ( jason london ) , de dezessete anos , se muda para a casa ao lado .  ",objetiva
3006,gravação de um concerto filmado como parte da turnê mundial live at last nos dias number e number de outubro de number na alemanha . ,objetiva
3007," o diretor francês henri declina é um dos cineastas mais importantes desde o início da década de number . no final de sua carreira , fez vários filmes com temática de espionagem , incluindo a história nickname carter vá atou cassar ( nickname carter vai destruir tudo ) .  ",objetiva
3008," el és aproveitam o convite da senhora . pinada , esposa do juiz distrital , e vão a um baile beneficente .  ",objetiva
3009," no hospício , aida percebe que a loucura pura definitivamente tem um propósito .  ",objetiva
3010,relembrando a exposição organizada por ocasião do number terceiro aniversário da chegada dos beneditinos à moradia ,objetiva
3011,ele usa seu barco e seu bom conhecimento das águas do lago para transportar pacotes de drogas do lado albanês para o lado macedônio . ,objetiva
3012," hoje , mórmon tem quase number anos e gostaria de esquecer essa parte de sua vida .  ",objetiva
3013,mas ele ainda não tem ideia de quão perigoso foi o jogo que ele realmente jogou . ,objetiva
3014,um paciente no hospital morre em circunstâncias misteriosas . ,objetiva
3015," ele tem relações particularmente tensas com o geógrafo volt che , que é o professor de classe dos nossos alunos do nono ano .  ",objetiva
3016," aino , a sedutora de joel , sussurra para ele : ' você é um pintor .  ",objetiva
3017," imediatam en te , seu rosto fica ridículo e feio .  ",objetiva
3018,o videoclipe da marionete traz uma visão nada convencional do ambiente circense em que um garotinho se encontra . ,objetiva
3019," com o dinheiro de seu pai e algo economizado , seus passos levam a uma casa estranha , que logo após uma crise financeira imprevisível se torna o lar de vários moradores mais excêntricos ; uma prostituta mentalmente quebrada e um cobrador de dívidas cruel .  ",objetiva
3020,o publicitário anja aluga um quarto em uma casa nos subúrbios de calcutá . ,objetiva
3021," a família originalmente britânica de mike campbell , que veio para o zimbábue há trinta anos e vive pacificamente em sua fazenda com quinhentos nativos , se oporá a farinho no tribunal .  ",objetiva
3022," no entanto , um animal vive aqui : o polvo costeiro .  ",objetiva
3023," no contexto das mudanças históricas ( a ascensão do fascismo , o crescente movimento comunista , a segunda guerra mundial e a guerra civil na iugoslávia , o papel decisivo da resistência comunista , a ruptura de tito com stalin ) , segue o destino do jovem comunista tomista karalho . , cuja vida pessoal é cada vez mais determinada por eventos políticos .  ",objetiva
3024,inúmeros reservatórios de água que permitiram que yucatán sobrevivesse durante a estação seca . ,objetiva
3025," el és secretamente o tiram do louvre , cuidadosamente guardados em uma caixa enorme , e quase na frente dos olhos dos ocupantes ' amanta és da arte ' , eles tentam levá-lo para um lugar seguro , para um castelo escondido .  ",objetiva
3026," entrevista com woo-ping bueno sobre como criar coreografias , john gameta sobre como criar efeitos visuais e mais .  ",objetiva
3027," por insistência de sua esposa , o simpático proprietário de uma fábrica de automóveis de sucesso , sam dodsworth , vende seu negócio e embarca em uma viagem ao exterior com ela para satisfazer sua sede de aventura , emoção e admiração dos outros .  ",objetiva
3028," após a morte do enxadrista , sua esposa pede a deus a ressurreição de seu marido .  ",objetiva
3029," apor és en está - nos detalhadamente o processamento da mistura de borracha em três rolos , onde é produzida uma tira de borracha de qualquer comprimento , em quatro rolos , onde são produzidas superfícies estampadas , com métodos de união de têxteis com uma mistura de borracha ou por fricção ou revestimento , com a produção de têxteis impermeáveis ​​por pintura e com a produção de borracha perfilada de qualquer comprimento na máquina de pulverização .  ",objetiva
3030," andrew hasselhoff , também conhecido como evil , concentra-se na ciência associada aos mistérios e fenômenos cotidianos .  ",objetiva
3031,uma companhia nômade variada percorre as propriedades do país sem muito sucesso . ,objetiva
3032,como ela tinha tanto poder ? ,objetiva
3033," em number de outubro , estima-se que mais de um bilhão de pessoas em todo o mundo assistiram à transmissão ao vivo do dramático resgate dos mineiros .  ",objetiva
3034,os americanos apostaram no desenvolvimento do foguete saturno ver . este foguete tinha mais de cem metros de altura e nunca falhou durante seus number lançamentos . ,objetiva
3035," no dia seguinte , ele confidencia ao amigo bloch que precisa ganhar algum dinheiro para ajudar seu pai , que o sustenta financeiramente .  ",objetiva
3036,conheça as armas do futuro e seu uso em possíveis conflitos de guerra . ,objetiva
3037," um exame médico revela um diagnóstico difícil - uma paralisia gradual incurável do sistema nervoso , que levará à morte dentro de dois anos .  ",objetiva
3038," de um mundo de promessas não cumpridas e sonhos não cumpridos , no qual você tem que lutar por tudo e nada é de graça .  ",objetiva
3039,também não está claro se a rainha resistirá à oferta mais tentadora ou não . ,objetiva
3040," imediatam en te , ela recebe um e-mail do assassino , no qual o psicopata a apresenta à vítima do próximo assassinato .  ",objetiva
3041," hel en a condirá anova canta a música amazing love , hana zagorová  ",objetiva
3042," o enredo é construído e dado pelas letras das músicas , e não o contrário .  ",objetiva
3043," o policial disfarçado carter se apresenta como motorista , arriscando sua vida sob o pretexto de se infiltrar em uma organização criminosa com sede em quatro das maiores cidades dos estados unidos .  ",objetiva
3044," mas charlie honestamente não se importa , porque ele pode ficar e continuar aproveitando a ' vida ' .  ",objetiva
3045,todos eles assistem silenciosamente a difícil luta de uma mulher que decide deixar o marido e parte para uma nova aventura de vida . ,objetiva
3046," no entanto , apenas duas pessoas acreditam nela , o cosmonauta brian harper ( patrick wilson ) e o teórico da conspiração kg hoffman ( john james ) .  ",objetiva
3047," dako logo se torna uma estrela , mas a comoção em torno de sua pessoa não combina com ele .  ",objetiva
3048," mas no exame de cabeleireira , rose percebe que michelle pensa que lilia é sua filha , de quem ela teve que desistir aos number anos .  ",objetiva
3049," logo , o segundo dos assassinos perece em uma explosão , e através da raiva de trento , o último tomas também .  ",objetiva
3050,os personagens de suas histórias do presente ou do passado recente se deparam com problemas que passam da aparente banalidade ao absurdo e podem se tornar monstruosidades destrutivas no final . ,objetiva
3051," guru decide visitar seu amigo ian clister , que fundou uma empresa para salvar a floresta tropical e cuidar das florestas locais , que estão desaparecendo gradualmente sob a pressão das empresas madeireiras .  ",objetiva
3052," de és de então , a infeliz meretriz apenas sobrevive .  ",objetiva
3053,ela cobre segará e escapa em sua sela . ,objetiva
3054,os prêmios de aniversário da associação de atores entram na segunda vigésima deste ano . ,objetiva
3055," registraram não só os elementos , mas também os dramas humanos nas ruas , nos telhados e nos porões , estavam com câmeras numa tentativa desesperada de salvar o máximo possível do patrimônio cultural , nadaram na água do bibliotecas municipais e nacionais , observaram os petroleiros que tentavam manter seus tanques perto do navio esquecido da costa , mapearam o trabalho dos voluntários em macho e karina .  ",objetiva
3056," ele , portanto , oferece-lhe dinheiro se ela deixar seu filho sozinho .  ",objetiva
3057," uma dramatização do grande roubo de trem de number , filmado em locações reais , mostra a preparação e execução da ação .  ",objetiva
