,FRASE,OBJ/SUBJ
6553,então eu olhei em volta por um tempo e parecia interessante e já que selena gomez está nele eu pensei em baixar o filme primeiro e baseado em assisti-lo eu comecei a assistir a série . ,subjetiva
6554,uma vez com a boca relativamente aberta e pronto . ,subjetiva
6555,é à maneira dos filmes de ação de hoje . ,subjetiva
6556,acho que a primeira série por si só é boa e vale a pena assistir . ,subjetiva
6557," além disso , a personagem de sarah brandi é maravilhosamente e com precisão retratada pela perfeita julianne moore .  ",subjetiva
6558," proletários de todos os países , lambam sua bunda .  ",subjetiva
6559,uma paródia exagerada de vários filmes ( como hot shots ) . ,subjetiva
6560," enquanto em number a personagem principal tem uma grande aventura salvando seu irmão e tem uma excelente carreira musical ela mesma , menos de number anos depois a mesma heroína é praticamente uma pária da civilização que fala bem francês ( talvez ) , inglês quebrado ( de fina it prezado en te ) e é necessário tirá-la dos braços da natureza e torná-la um polifônico moderno .  ",subjetiva
6561," ao invés de uma história , é um show de realidade virtual psicodélica ( como anitrávníká a ) .  ",subjetiva
6562,é cheio de negros e também cheio de porcarias desajeitadas e usadas sem exageros . ,subjetiva
6563,por um tempo eu não sabia de que lado eu deveria estar - o grande dante ou o professor ? ,subjetiva
6564,que sorte eu tenho de ter descoberto essa série . ,subjetiva
6565," o conde definitivamente terá mais trabalho a ver com isso - ou seja , principalmente a parte física , enquanto o cavaleiros era mais propenso a inventar cifras do que perseguir alguém .  ",subjetiva
6566," ou seja , para a maioria da população em geral .  ",subjetiva
6567," já és física ( natasha longe ) , que se tornou lésbica , também apareceu na reunião da escola , e hermano ( chris owen ) , a quem stifler ajudou a embalar a colega de leni , também não poderiam faltar .  ",subjetiva
6568,um sonho dentro de um sonho dentro de um sonho dentro de um sonho . ,subjetiva
6569, então as chances de ser encontrado vivo caem consideravelmente . '  ,subjetiva
6570,́ ́ igor camélia no papel de um cavalo que assinava até acabar o lápis . ,subjetiva
6571," eu nem gostei de matrix quando o vi na época de sua estreia , muito menos hoje , visto dez anos depois .  ",subjetiva
6572,terceiro : processamento minimalista e trabalho com poucos atores . ,subjetiva
6573,há até um vislumbre do meu boschi favorito do universo mario ( embora o inferno saiba se é ele - ele não é nem de longe tão fofo quanto no jogo ) . ,subjetiva
6574,veredicto do juiz : number sem dúvida 👍 🏻 ,subjetiva
6575," eu tenho um pouco de musgo anão , mas essa é a qualidade , olha , quando eu chicoteia da última vez por mais number dias , eu pude ver muito .  ",subjetiva
6576,de vez em quando talvez seja possível ser devidamente manipulado por um criador capaz . ,subjetiva
6577," foi só então que senti um calafrio na espinha , mesmo que essas legendas informativas não estivessem realmente relacionadas ao filme de forma alguma .  ",subjetiva
6578,mas eu queria ver outro filme desse cenário animado . ,subjetiva
6579,arte de ficção científica para espectadores mais exigentes com um tema interessante da vida real . ,subjetiva
6580," um belo western file à moda antiga , é claro , estrelado por franco nero como o sensato jango .  ",subjetiva
6581, ah . a reciclagem do programa ' seu it case ' que enfeitou as telas da televisão pública por anos antes que o tempo a levasse para sempre .  ,subjetiva
6582, . usuário blues pensou ' oh meu deus ' !  ,subjetiva
6583," cru , cheio de emoções , com um clima de época preciso e lutas de boxe sugestivamente filmadas .  ",subjetiva
6584,todo mundo sabe que não pode confiar em ninguém . ,subjetiva
6585,e ainda se reproduzem com uns e zero porque não têm bolas . ,subjetiva
6586,este filme não me empolgou tanto quanto as partes anteriores . ,subjetiva
6587,ainda não consigo encontrar as palavras certas para expressar o que acabei de ver . ,subjetiva
6588,e eu teria mais um desejo modesto . ,subjetiva
6589,um drama histórico com elementos de um conceito moderno . ,subjetiva
6590," então , eu acabei de tomar deliciam desse filme .  ",subjetiva
6591,mas uma vez por ano eu olho para ele . só por nostalgia . ,subjetiva
6592," há apenas uma cena realmente assustadora , caso contrário , tudo vale a pena .  ",subjetiva
6593,eu tenho sentimentos mistos sobre esse filme . ,subjetiva
6594," não és se curto espaço de tempo , formou-se entre eles um vínculo que às vezes não pode ser formado em toda a vida .  ",subjetiva
6595," eu estava esperando algo parecido com the eli book , mas isso . ?  ",subjetiva
6596," e tocheiro tibetano , segundo os críticos da década de number , ' o john wayne japonês ' ?  ",subjetiva
6597," bem , não sei como o the brides conseguiu , mas conseguiu se transformar de uma bagunça colossal em uma coisa confortável que não precisa se envergonhar de si mesma e até vai para o lixo em vez de um externo .  ",subjetiva
6598," ele está claramente torcendo pelas pessoas marginalizadas de que fala , mas na cena com o condutor no trem , por exemplo , não há indicação dos problemas que encontrar pessoas com deficiências semelhantes traz ao condutor em seu trabalho .  ",subjetiva
6599,e a angelical annabelle alis em sua calcinha vai agradar a todos os olhos dos homens . ,subjetiva
6600," o lado técnico , claro , é válido para a época e ficou especialmente evidente no confronto final com o cetáceo , mas o espectador perspicaz contará com isso .  ",subjetiva
6601," diálogos estúpidos , ford estúpido , hauer estúpido , tudo estúpido .  ",subjetiva
6602,imagine a tropa de elite nas ruas estéreis de uma cidade norueguesa . ,subjetiva
6603,embora eu não saiba se o filme tem algum tipo de status cult na frança . ,subjetiva
6604," e o clímax do filme continha talvez algumas das cenas mais violentas que eu já vi , o que contribuiu muito para o clímax fantástico , após o qual eu estava completamente fora de mim .  ",subjetiva
6605,a adaptação cinematográfica da novela de urgente sempre me excita de novo e de novo . ,subjetiva
6606,eu tive que fazer uma pausa no meio porque eu estava muito entediado . ,subjetiva
6607,crianças e adultos vão se divertir com ele . ,subjetiva
6608," a princípio , parece que o filme será dirigido para o estranho .  ",subjetiva
6609,uma edição decentemente elaborada e um fundo musical adequado foram capazes de criar uma atmosfera / és espetáculo interessante . ,subjetiva
6610,posso assinar o comentário da clinica . ,subjetiva
6611," do meu ponto de vista , a história vacila um pouco quando não está totalmente claro quais são os motivos do personagem principal no início e por que ele faz o que faz e como ele chegará ao motivo principal e à ação posterior ( como ele de repente encontrar algum ouro ? ) .  ",subjetiva
6612," havia algo interessante nesse filme e isso não pode ser negado , fiquei fascinado com seu estilo , a maneira como eles fingiam ser outra pessoa e funcionou perfeitamente , não posso culpá-lo muito , você não pode esperar muito do filme , mas também não é muito errado , não é apenas sobre como é filmado , mas também sobre o fato de que todos percebem algo , todos conhecem a felicidade , mesmo que grace pudesse ter sido um pouco mais longa no final do filme .  ",subjetiva
6613,eu me acostumei com os livros bastante desconexos de brent sendo simplificados por causa do filme ( embora muitas vezes pareça desnecessário ) . ,subjetiva
6614,eu definitivamente recomendo encontrar o filme que serviu de modelo para este . ,subjetiva
6615," a intrusa mais burra de todo o brasil / seu detento foge , é espancado entre as portas da casa no apartamento daquele que querem pegar e a segurança dos colegas durante a intervenção é uma bala / ela se diverte em a festa da cidade incluindo seu chefe arrogante , isso é loucura para mim miasmas olhei aqui , eu não sei por que eu mesmo , talvez para alertar contra perda de tempo e adicionar fotos  ",subjetiva
6616," no final do filme , o psicothriller se torna mais um banho de sangue , mas muito bem feito :) .  ",subjetiva
6617," o máximo que pude fazer foi rir de infetou . desculpe , chuck .  ",subjetiva
6618," na média geral , o segundo homem aranha simplesmente não fez nada por mim .  ",subjetiva
6619,posso imaginá-lo mais como uma peça . ,subjetiva
6620,uma experiência verdadeiramente fascinante e um filme que vai fazer você acreditar em absolutamente tudo porque é extremamente cativante e costner é o cara . ,subjetiva
6621,então para fazer uma pessoa sentir frio . number ,subjetiva
6622," uma leve decepção veio apenas no final , o que não estragou a impressão geral , mas depois do implacável entretenimento de cinco estrelas , eu provavelmente esperava um pouco mais dele .  ",subjetiva
6623,adocem en etários sobre a vida sob a superfície do mar nunca deixam de me divertir . ,subjetiva
6624,só lamento o grande foco na frente ocidental ( ou pouca informação sobre aru ou rússia ) . ,subjetiva
6625," alguns tinham grande autoconfiança , outros eram estúpidos de nascença e depois havia os recessivos .  ",subjetiva
6626,então eu entrei no filme corretamente e a partir do minuto number eu estava em um verdadeiro transe de filme e descendentes of homem me agarrou . ,subjetiva
6627," em primeiro lugar , provavelmente o ' és boço ' de ajude law , cujo papel é decididamente sem vida , mas não o estraga .  ",subjetiva
6628,uma pausa para o banheiro depois de inserir uma pergunta ? ) ,subjetiva
6629,eu gosto de filmes desse gênero e peguei rogue depois de assistir o semelhante touch of fate . ,subjetiva
6630," deve - se mencionar que apresenta dois dos meus atores favoritos nos papéis principais , os quais lidam com os papéis com cores voadoras .  ",subjetiva
6631," um passeio que classifica - é claro , não é muito surpreendente , nem muito crível .  ",subjetiva
6632," urgh , eu terminei com isso , agora só elogios .  ",subjetiva
6633," bem , assim . se eu levasse minha avó para uma aula de tricô de meias , ou decidisse acompanhar minha vizinha dentuça na castração de sua amada vassoura , tenho quase number de certeza que seria mais divertido do que isso .  ",subjetiva
6634," além disso , a dupla seidlová e masopust não parece nada fiel , pelo contrário , seus diálogos de recitação fraseológica me incomodaram muito , em termos de miséria dos atores .  ",subjetiva
6635," on de serene perdeu no aspecto musical , aqui xantoma ganha pontos extras , mas onde serene ganha pontos extras pelo ideal fantasmagórico de londres e estilização em uma forma louca , lá xantoma perde o fôlego e parece ter sido roído pelos estragos do tempo .  ",subjetiva
6636,jean - aba parte diste emanuel zoar é um dos vilões mais legais de todos os tempos . ,subjetiva
6637,um dos filmes mais desesperados que já vi . ,subjetiva
6638," mas algo não está à altura , um final digno de romances à la o silêncio dos inocentes , tão apenas number * , embora parecesse melhor no início .  ",subjetiva
6639," mas tudo depende , talvez um pouco surpreendentemente , de quanta atenção johnny depp atrai . seu chapeleiro não é um ajudante , mas um personagem principal igual que quase ofusca até mesmo a maravilhosamente irritada rainha vermelha ou a simpática alice .  ",subjetiva
6640," os personagens chatos dos outros personagens ( além da heroína principal , ninguém realmente se destaca como ator ) infelizmente só ganham tanto espaço quanto a heroína principal ' gosta ' deles .  ",subjetiva
6641,uma troca de descanso por uma noite fria de um vagabundo entediado - serviu ao seu propósito . ,subjetiva
6642," os atores ' brincam ' , embora você acredite em suas emoções , mas eles são apresentados de forma muito descuidada .  ",subjetiva
6643," no final , há cenas do show , que começa com o jingle , um dos motivos do filme the good , the bad and the ugly / good things just have to be together / , e começa o novo hit do metallica , frâncico .  ",subjetiva
6644,el és estavam realmente assustados com isso e simpatizavam muito com ele . ,subjetiva
6645,isso significa que entre os avaliadores há uma parcela muito maior de espectadores que apreciam as qualidades desse diretor tipicamente asiático . ,subjetiva
6646,mas com certeza assistirei novamente ( o que normalmente não posso dizer sobre outros filmes tchecos ) e talvez reconsidere . ,subjetiva
6647," para mim , discordo de um grande não .  ",subjetiva
6648," uma porcaria híbrida provavelmente composta por hery protrai , academia de polícia , jurassic park e as ideias bizarras de outra pessoa após uma overdose de esponjas .  ",subjetiva
6649," o objeto de interesse é nam-seok checo ( um jun-seok kim muito interessante ) , um jornalista que se perdeu em uma viagem e vem da misteriosa ilha de paraná .  ",subjetiva
6650,michael bay realmente acertou em cheio . ,subjetiva
6651," mas eu veria muitas variantes melhores em vez de david švehlík no papel-título , bem como no representante de sua esposa ( tatiana vilhelmová ) .  ",subjetiva
6652,wim wenders criou um trabalho incrivelmente elaborado que foi realmente incrível no momento de sua criação . ,subjetiva
6653,postscript : não entendo qual a velocidade que você imagina ao processar o assunto em casa . ,subjetiva
6654," na verdade , eu aceitaria se o final fosse ainda mais negativo - se fosse um amor tão ' maravilhoso e magnífico ' , então o que o pobre tocador de cítara faria sozinho ?  ",subjetiva
6655," apo en as alguns minutos atrás eu ouvi : ' hakan , você vai morrer de frio na sibéria .  ",subjetiva
6656," até petar štěpán tratou do misterioso bela em seu livro , onde também mencionou muitas vezes seu melhor amigo boris balofa ( frank en stein number ) , mas isso é outro capítulo .  ",subjetiva
6657,mas não posso dizer que ele é ruim . ,subjetiva
6658,uma excelente versão de uma comédia de teatro francesa de câmara . ,subjetiva
6659,já estou com medo de sair porque acho que esses indivíduos estão se movimentando neste planeta . ,subjetiva
6660,já comecei a simpatizar com ela em dupla . ,subjetiva
6661," mal posso esperar pela última parte , que promete ser um espetáculo emocionante e que possivelmente pode subir para o número completo .  ",subjetiva
6662," on de ano , senhor . ministro generalizou e onde episódios individuais foram cuidadosamente apontados , denis é limitado pelas grades de memórias e eventos específicos .  ",subjetiva
6663," talvez sem eles , o filme não teria me causado tanta impressão .  ",subjetiva
6664,eu não me importo e estou feliz em assistir ao filme . ,subjetiva
6665,embora hoje eu me deparei com isso no čt1 e devo dizer que é muito estúpido :) ,subjetiva
6666," faltou um pouco de erotismo , mas mesmo assim foi uma noite de domingo agradável e emocionante .  ",subjetiva
6667," eu daria nota máxima só para depardieu , porque ele brilhou .  ",subjetiva
6668," incluindo en te grandes atuações : betting , spacey , mas também lies sim . baker .  ",subjetiva
6669," no entanto , várias partes foram filmadas de forma bastante envolvente , então eu fecho os olhos para a pilha de lastro desnecessário .  ",subjetiva
6670," e eu me diverti , mas agora eu tenho que lubrificar as juntas de aço das minhas mãos , elas estão começando a ranger de digitação robótica no mundo binário chamado internet , e então eu me jogo em uma briga com um aspirador de pó robótico .  ",subjetiva
6671,inter és soante cientista mark ruffalo com sua linda namorada rachel dunst . ,subjetiva
6672," a única falha deste filme perfeito em seu gênero é o final excessivamente doce , pelo qual dou quatro estrelas em vez de cinco .  ",subjetiva
6673," não é como se eles vissem menos do que , digamos , sua namorada , a esposa do banqueiro , que gradualmente enlouquece com as evidências crescentes daqueles abismos engomados e acaba tomando muitas pílulas para dormir .  ",subjetiva
6674," o grande encontro consigo mesmo é um confronto com uma das possibilidades que a visão do carma traz : se vejo não apenas a inevitabilidade da morte de alguém , mas também sua justificação como punição narcísica pelo mal cometido em uma vida passada , por que não encontrar e se tornar um instrumento de carma e a pessoa em questão não se desfazer de si mesmo ?  ",subjetiva
6675," outra sequência desnecessária , isso deveria ter terminado com um empate e nada mais .  ",subjetiva
6676," algumas das citações e cenas estavam corretas , e algumas coisas podem ficar na minha cabeça por um tempo .  ",subjetiva
6677,não invejo os criadores do source code a classificação do gênero . ,subjetiva
6678," para um filme de ação , a ação é processada de maneira bastante desajeitada , para um filme de terror não há medo e quase nenhum sangue , para um filme de ficção científica não há atmosfera e tensão .  ",subjetiva
6679," o cenário no século vi é apenas um pano de fundo formal para o enredo , a música que o acompanha seria muito mais adequada a algum doce açucarado contemporâneo .  ",subjetiva
6680," um jogo de sombras cinza-preto - e - branco rachado que , infelizmente , passou por mim friamente depois da meia-noite de hoje .  ",subjetiva
6681," claro , provavelmente não há necessidade de fingir a moda do youtube , talvez isso pegue em breve .  ",subjetiva
6682," e há mais um elemento de conexão - o falecido anton infringe novamente desempenhou o papel de um oficial nazista aqui , embora tivesse que esperar até o calosas adere para um lote maior .  ",subjetiva
6683," o enredo de ledice era totalmente desinteressante , os personagens jovens antipáticos e outros personagens completamente sem uso .  ",subjetiva
6684,para en so em vão sobre por que este filme foi feito e o que o senhor . taro afã queria dizer . ,subjetiva
6685," e como felizmente não sou membro da comunidade acadêmica , para que estudantes conscientes de estudos de gênero e outros estudos inúteis me excluam dela , darei o lixo apenas por princípio e com alegria infantil que dei a todos aqueles ativistas .  ",subjetiva
6686,também porque tenho uma grande fraqueza por moni reik novata a e bitu afã kabátová . ,subjetiva
6687,eu não estava entediado nem por um momento e cada segundo do filme é exatamente onde deveria estar - eu não experimento isso há muito tempo ( se é que nunca ) . ,subjetiva
6688,vamos comer pipoca . sexo . - não ! ,subjetiva
6689,eu nem sei mais o que acrescentar . ,subjetiva
6690,eu também tive um problema com a maioria dos personagens - eles não eram simpáticos para mim e eu não desenvolvi um relacionamento com eles . ,subjetiva
6691," quando eu tinha number anos , eu gostava muito de assistir .  ",subjetiva
6692," imediatam en te após sua partida , porém , fica claro que a esposa também tem seus segredos , quando um homem estranho com cara de agente secreto aparece em sua casa .  ",subjetiva
6693,eu estava com muito medo de que mesmo na ficção científica pudesse haver algo wtf ( eminente de sim espaciais :d ) . ,subjetiva
6694," ingênua , mas rica em cenários e nutritiva .  ",subjetiva
6695," eu vi os primeiros episódios e não vou assistir mais , e se visse , minha classificação provavelmente cairia .  ",subjetiva
6696," uma grande surpresa , talvez os amoleces não fiquem com apenas uma boa foto - number .  ",subjetiva
6697," eu nem sei se algum anime tem mais de quatro sequências ( não conto produções japonesas ) , mas eu não teria medo de uma quinta parte da era do gelo se vier com uma ideia interessante novamente e de preferência novamente com a avó do sid :)  ",subjetiva
6698,o mito bourne fez exatamente isso ao pé da letra . ,subjetiva
6699,às vezes nos perdemos na confusão dos diálogos profissionais . ,subjetiva
6700," eu me diverti muito assistindo por number horas , e esperar pelo próximo episódio às vezes era excruciante .  ",subjetiva
6701," a segunda metade já é muito lenta , o final é mais um lançamento .  ",subjetiva
6702,porque quem subiria lá uma segunda vez . ,subjetiva
6703," martin é bem gordinho , não se envolve muito em eventos e , quando o faz , é mais o rabo de will .  ",subjetiva
6704," no geral , no entanto , parece bastante disperso , apressado , sem suco e , acima de tudo , sem atmosfera .  ",subjetiva
6705," sempre me interessei pela organização shell , mas estava um pouco curioso para ver como a marvel se sairia em forma de série .  ",subjetiva
6706," um drama brilhantemente filmado sobre o desamparo humano , a velhice , a solidão , mas principalmente sobre a amizade sozinho - ruim .  ",subjetiva
6707," do ponto de vista de um princípio moral superior , não assistir a este filme brilhante não é um crime , mas de qualquer forma , se ainda houver quem tenha um ' a ' para este filme de mais de cinquenta anos , eles devem corrigir isso muito rapidamente .  ",subjetiva
6708,só recentemente descobri este filme . ,subjetiva
6709," tantas alunas bonitas e nem um único mamilo , é uma merda .  ",subjetiva
6710," qual é o ponto quando o filme é tecnicamente bem feito , mas é um tédio descarado sobre nada .  ",subjetiva
6711," a última aventura dos famosos mosqueteiros , que provam que o lema um por todos , todos por um ainda se aplica após vinte anos .  ",subjetiva
6712," o papel da jovem foi interpretado por biraia famulo , atriz austríaca conhecida pelas comédias e filmes eróticos dos anos number . o roteiro foi escrito por mario d'alcala .  ",subjetiva
6713,inter és soante thriller pouco conhecido com frank sinatra e esterlina hayden . ,subjetiva
6714," um filme de guerra mediano , mas com uma dimensão espetacular de ação .  ",subjetiva
6715," e assim , em vez de ' a mais bela história de amor ' ( como li aqui ) , fiquei com um tédio brutal em que realmente não acreditava em nada .  ",subjetiva
6716,a tensão combinada disfarçada de drama profundo deixou uma marca clara em minha experiência do mundo . ,subjetiva
6717," klaus é compreensivelmente terrivelmente previsível , o espectador sabe como vai acabar .  ",subjetiva
6718," e o querido aru afã também desenvolveu a imagem de um chef que prepara refeições que todos podem pagar , depois do intrometido inspetor de alimentos .  ",subjetiva
6719," no entanto , a ideia em si é muito engenhosa .  ",subjetiva
6720,embaraçoso e alemão nisso . ,subjetiva
6721," o diretor do bombando de arnold escalou o jovem jackie palmer em seu próximo filme de ação decente , que deu seu melhor papel no cinema aqui .  ",subjetiva
6722,então eu coloquei o cadê no drive e eis . ,subjetiva
6723," o resto não é exatamente ruim , mas você pode ouvir muito o farfalhar do papel , há grandes coincidências em todos os lugares e os personagens de repente são mais como marionetes .  ",subjetiva
6724,este último é o principal . é preciso transmiti-lo e superá-lo juntos . ,subjetiva
6725," então number estrelas para mim , me diverti do início ao fim e gostei do fato de também me fazer pensar um pouco sobre o que aconteceu nos episódios anteriores e como se encaixa neste .  ",subjetiva
6726," no entanto , mesmo sem o clímax cavalheiresco , é um padrão comum para louva-a - de us e , além disso , bijus ai proibiu esguichos sob pena de garfos em brasa eternamente empalados na bunda , então o pai pós-apocalíptico do ano provavelmente mergulhou desprotegido apenas porque ele é demente , ou assim que todo mundo seria , e junto com nós espiões , eles desfrutaram um pouco daquela adrenalina canibal .  ",subjetiva
6727," esperava mais ação , o que falta desesperadamente com algumas exceções , e acima de tudo , a quantidade de personagens circulando por aqui me confundiu muito .  ",subjetiva
6728," é muito estranho , a ponto de ser um pouco ' assustador ' , que um escritor malsucedido de quarenta anos , mal capaz de cuidar de si mesmo , faça amizade com uma garota do ensino médio um tanto estranha , mas ainda mais ou menos normal , e em que condições .  ",subjetiva
6729," uau , para um filme alemão foi uma explosão .  ",subjetiva
6730," a vida torce sensualmente seus quadris , prende a respiração com excitação e tenta flertando o significado da experiência .  ",subjetiva
6731,eu recomendo a todos os pais que têm filhos pequenos e atualmente estão hesitando em qual conto de fadas jogar ! ! ! ,subjetiva
6732," na forma em que tive a honra de vê-lo , ficou muito bom ! ! !  ",subjetiva
6733," foi colorido e sangrento , épico e indescritível , brutal e cheio de amor .  ",subjetiva
6734," eu reconheço a presença de estrelas atuantes , mas elas não receberam espaço suficiente e seu potencial permaneceu sem uso , veja rogue ben .  ",subjetiva
6735," mas você gradualmente se apaixonará por todos os membros da família james , e mais divertido você terá .  ",subjetiva
6736," uma vitória completamente inesperada de uma pessoa que , pelo menos de acordo com a imagem que foi retratada no filme , não estava jogando para nada .  ",subjetiva
6737,mas quem mais derrubou o filme foi inesperadamente corrico dessa vez . a música às vezes parecia que ele estava puxando gatos pelo rabo . ,subjetiva
6738," não foi ruim lá , mas não foi a mesma coisa , e eu realmente não preciso do ator martin desdar .  ",subjetiva
