,FRASE,OBJ/SUBJ
2245," diana ross , uma cantora famosa na época , foi escolhida no lugar da empolada dorothy , e michael jackson , que estava começando , ganhou o papel do espantalho .  ",objetiva
2246," um documentário sobre um projeto austríaco único , que aproxima não apenas a história de oitenta anos do estado moderno dos nossos vizinhos do sul , mas também as raízes da europa comum .  ",objetiva
2247," ao mesmo tempo , o filme faz perguntas muito pessoais sobre família , vida , envelhecimento e morte ; tendo como pano de fundo o cenário da bolívia , um dos países mais pobres do mundo .  ",objetiva
2248," enfurecido , john alcance atribui a seu ajudante escalei a tarefa de vingar dennis .  ",objetiva
2249," quando eles começam a morrer , um mima indefeso e assustado desce em perigosas imaginações retardadas .  ",objetiva
2250," el és se perdem em seus jogos de palavras , provocam um ao outro , ficam entediados , falam sobre a morte ou flertam um com o outro em passeios em território adulto .  ",objetiva
2251, a artista charlotte ( amai dólmen ) encontra um misterioso ' quadro de bruxas ' em seu novo apartamento .  ,objetiva
2252,torneios espetaculares e músicas de época de peter trailer sublinham o sabor medieval do antigo conto de fadas . ,objetiva
2253," ele ama a filha do dono da fábrica , marcela , mas ela prefere peter .  ",objetiva
2254," não és está série de quinze partes , sua caminhada pelas pitorescas ruas de paris é acompanhada de medo , porque ninguém pode escapar de todos aqueles olhares atentos .  ",objetiva
2255,os heróis das cinco histórias do filme húngaro de félix máriássi - os habitantes do subúrbio de budapeste de crepe - viveram anos sem dormir . ,objetiva
2256,a televisão tcheca preparou um novo programa moderno que oferece aulas de dança com todos os aspectos que esse fenômeno representa de maneira divertida e educativa . ,objetiva
2257," quando duas irmãs começam a suspeitar de seu pai ( john argento ) de infidelidade , elas começam a entrar em pânico e a fachada da felicidade de sua família começa a mostrar rachaduras .  ",objetiva
2258," no documentário de thomas riedelsheimer sobre a musicista evence agencie , não será tão difícil quanto parece à primeira vista .  ",objetiva
2259,mas guy tem sua moto confiável e não tem medo de usá-la mesmo na índia ! ,objetiva
2260," newton , um prisioneiro no infame campo de prisioneiros de guerra alemão , que passa seus dias inventando todos os tipos de esquemas e negociando com os alemães em troca de privilégios especiais .  ",objetiva
2261," à noite , enquanto frank está em um festival folclórico local , um ass ótima ( forma gabolice ) ataca a reserva e mata o porteiro , taba .  ",objetiva
2262," em uma festa , ele se envolve em uma discussão e nocauteia o atual campeão peso-pesado de boxe chuck mcgraw com um soco .  ",objetiva
2263,dois homens e duas mulheres ficam fascinados com o famoso quadro de manet café da manhã na grama e decidem organizar um piquenique na natureza exatamente de acordo com o modelo . ,objetiva
2264," é por isso que as pessoas têm que protegê-los , mesmo que às vezes isso vá contra as necessidades dos nativos .  ",objetiva
2265," martin , que sempre quis algo parecido , está animado .  ",objetiva
2266," finney shaw é um garoto normal de treze anos cuja vida é mudada por um assassino sádico que o sequestra e o aprisiona em um porão à prova de som , onde não faz sentido pedir ajuda .  ",objetiva
2267, o documentário ' a história do prato opo a en sia ' informa sobre o que é a verdade .  ,objetiva
2268," no filme , o diretor gabriele mucina retorna às suas raízes italianas e aos dramas de amadurecimento que o tornaram popular com o público antes de sua carreira nos estados unidos .  ",objetiva
2269," a história se chama baja a zambi , e o diretor pavel andores está atualmente filmando perto da vila de křižánky em vaso yin .  ",objetiva
2270,o verão que mudou toda a sua vida . ,objetiva
2271," como parte da lei de restituição de indenização por danos materiais , depois de number ele receberá sua fazenda .  ",objetiva
2272,é um evento único em uma geração que conquistará o mundo literário e o público pela tempestade . ,objetiva
2273,entre os itens roubados está também uma pintura muito valiosa de renoir . ,objetiva
2274," a maior parte da cidade de moletom , onde ele morava , trabalhava em uma grande fábrica local e , quando suspendeu a produção , quase a vida começou a se perder na terra sueca de maryland .  ",objetiva
2275," o punhado de homens reunidos por acaso está agora à mercê do deserto inóspito , do calor escaldante , do sol ofuscante e de um inimigo invisível .  ",objetiva
2276,uma história sobre a complexidade dos relacionamentos em um casamento jovem . ,objetiva
2277," bambai , o cervo , vive seu primeiro inverno .  ",objetiva
2278," apor en de ando à parte por um tempo , pô apresenta seu verdadeiro pai , o panda lio , à sua casa , sua vida até agora e seus amigos .  ",objetiva
2279," embora robert não esteja exatamente empolgado com isso , ele deixa gisele dormir em seu apartamento , fazendo uma bagunça com sua namorada de longa data nancy ( lorde menezes ) .  ",objetiva
2280,star wars : star é uma aventura repleta de ação no espírito do lendário star wars . ,objetiva
2281,sua equipe consiste em uma nova geração de aventureiros . ,objetiva
2282,ele será mais afetado pelas imagens documentais do piloto que jogou seu avião no chão e morreu . ,objetiva
2283," logo no início , maria vê como o javali e a porca não querem acasalar , precisam ser ajudados com rum .  ",objetiva
2284," a série marriage paisley foi transmitida pela czechoslovak television em number , e os episódios individuais traçaram a vida de seis jovens casais de seu casamento por um período de seis anos ( number - number ) .  ",objetiva
2285,um vigia noturno entediado observa os monitores do sistema de segurança no calor de sua guarita . ,objetiva
2286,um grupo de adolescentes tropeça no túmulo de um homem enquanto caminhava à noite . ,objetiva
2287,de és cubra o que estamos dispostos a fazer por amor com uma história romântica baseada em fatos reais . ,objetiva
2288," um filme instrutivo soviético que , usando o exemplo de uma fábrica soviética , mostra como organizar efetivamente os esquadrões de bombeiros voluntários e , assim , proteger preventivamente a propriedade socialista .  ",objetiva
2289,é o conhecimento do povo bambara passado de geração em geração . ,objetiva
2290," o enredo do filme nos leva à paisagem exótica da áfrica quente nas areias quentes do saara , onde cenas de ação de sexo lésbico por dançarinas árabes são intercaladas com penetrações anais , sanduíches ou trios entre camelos .  ",objetiva
2291," ainda de luto por sua esposa , músico , compositor e pai viúvo terry baronete chega com seu filho adolescente jordan para passar algumas semanas de férias de verão em florida keys .  ",objetiva
2292,ele declara um alerta e os helicópteros confirmam que o radar não está informando nada . ,objetiva
2293,o mata lacta praga é um dos eventos mais prestigiados do gênero . ,objetiva
2294," max se apaixona por uma garota que não conhece , então pede ao pai dela que marque um encontro .  ",objetiva
2295," em number , criminosos de guerra nazistas foram julgados nos julgamentos de nuremberg , enquanto o mundo inteiro tentava fazer um novo começo pós-guerra .  ",objetiva
2296,ela se lembra de sua infância com uma mãe alcoólatra . ,objetiva
2297,judy carter ( kim basinger ) é uma escritora apaixonada pelo jogo que está destruindo seu casamento e sua família . ,objetiva
2298,a turbulenta situação do pós-guerra traz ameaças a cada passo . ,objetiva
2299," em number , cineastas do videojournal ( dobra-la born , jaroslav ko ian e michael haber ) conseguiram filmar extra-oficialmente uma entrevista com o pintor em seu estúdio sobre os problemas que ele teve que resolver em seu trabalho e em sua vida .  ",objetiva
2300,uma madrasta e duas meias-irmãs foram adicionadas à família . ,objetiva
2301," tratava - se principalmente de envolvimento em eventos beneficentes , baseados no voluntarismo , ou seja : na necessidade de ajudar desinteressadamente o próximo .  ",objetiva
2302," pouco depois de chegar , eles encontram um carro assustado , que eles param , mas em vez de uma recompensa , eles passam a noite na delegacia .  ",objetiva
2303," a população de detroit caiu pela metade , deixando number casas abandonadas após aqueles que deixaram a cidade .  ",objetiva
2304," o ladrão só quer o dinheiro dele , mas toda vez que ele tenta arrombar o mausoléu , alguém o interrompe .  ",objetiva
2305," um filme que é , por assim dizer , sobre nada : o único enigma é se a pequena rabies vai tirar seu dinheiro do buraco onde caiu antes que a peixaria feche .  ",objetiva
2306," george e chin também são apoiados pela jovem e bela rose , que se apaixona por george e também sabe como chegar aos japoneses .  ",objetiva
2307," não és te momento , a primavera estava chegando à aldeia .  ",objetiva
2308," no entanto , estes não são casos fáceis e muitas vezes beiram a moralidade interna .  ",objetiva
2309," o filme cria um retrato vívido e divertido do mundo do budismo tibetano como se manifesta no ocidente , fazendo uma pergunta crucial : esses ensinamentos antigos podem nos ajudar a encontrar a verdadeira felicidade na era moderna cada vez mais caótica de hoje e criar um mundo mais são e compassivo ? no século number ?  ",objetiva
2310," esposa e mãe de dois filhos pequenos , sally bertrand , que está sendo cuidada por michelle winston , de number anos , morre inesperadamente .  ",objetiva
2311," a batalha de mercador tornou-se assim um ponto de virada no desenvolvimento da guerra , e a alemanha nunca se recuperou dessa derrota devastadora .  ",objetiva
2312," fingindo ir a uma conferência de segurança e equipada com o traje testado e comprovado de uma negra velha e gorda , ela se apresenta como a nova babá das crianças rebeldes muller .  ",objetiva
2313," através de visitas regulares a um psicoterapeuta , as memórias ganham vida , enquanto esconda e o co-diretor eric mayer transitam entre retratar uma infância aparentemente despreocupada e o presente com admirável liberdade e engenhosidade teatral .  ",objetiva
2314,um assassino psicótico usa um saca-rolhas para entrar no cérebro de suas vítimas . ,objetiva
2315," est és examinam o caso de amor da cantora com susan rose ; sua última noite escura na terra ; e o efeito de suas músicas e morte em fãs , amigos e inimigos .  ",objetiva
2316," ele esconde sua verdadeira identidade primeiro como cantor de circo , depois vagueia com ciganos e finalmente decide aceitar o destino de um vagabundo .  ",objetiva
2317,adocem en etário sobre a vida com uma doença degenerativa e principalmente sobre pessoas que cuidam de seus entes queridos . ,objetiva
2318," infeliz en te , ele perdeu um cliente no último evento e a agência de michael faliu imediatamente .  ",objetiva
2319," quando o rei da selva se recusa a liderar um grupo de antropólogos para uma área até então inexplorada chamada festim , habitada por misteriosas mulheres amazonas , seu filho boy é persuadido pelo cientista , mas ele não sabe que não há como escapar de festim . .  ",objetiva
2320," reinventa en de antem en te , essa não é uma característica do filme tempestade tropical , mas uma introdução à sua história , que promete uma experiência extraordinária para fãs de todas as formas de humor .  ",objetiva
2321," ele quer recuperar seu antigo status social , mas é tarde demais .  ",objetiva
2322," graças a um telefonema de uma jovem , vera , aloés descobre um mundo secreto de fantasia .  ",objetiva
2323," se ela conseguir , ela será julgada por três acusações de homicídio e uma acusação de tentativa de homicídio .  ",objetiva
2324," o documentário está repleto de cenas da aviação naval e infantaria , mas principalmente de porta-aviões e cruzadores da marinha .  ",objetiva
2325," produzido durante sua apresentação ao vivo no constitution hall de washington , williams se concentrou na política , revelou seus pontos de vista sobre saúde , propôs uma versão pessoal de sucata , falou sobre drogas e deu aos espectadores um olhar privado quando falou sobre sua recente cirurgia cardíaca .  ",objetiva
2326,concerto do festival internacional de jazz jazz goês to town number . ,objetiva
2327," uma comédia sobre um homem ( adam sandler ) que quando adolescente no ensino médio teve um filho com seu professor ( andy lanza ) e agora , anos depois , vem ao casamento de seu filho .  ",objetiva
2328," e assim personalidades como frank rice , paul simon , joe cocker , billy presto , susan vega apareceram diante de um público que não esperava mais por isso .  ",objetiva
2329," prático em engarrafamentos cansativos , agradável para passeios noturnos de namorados e prático para passeios em família .  ",objetiva
2330,uma coleção de clipes de música da famosa banda britânica parking heads . ,objetiva
2331," number é um conto emocionante de sorte , oportunidade , perda de inocência e a relação entre poder e dinheiro .  ",objetiva
2332," subindo a parte mais íngreme e fria do pilar , maravilhe-se com a determinação de alpinistas de classe mundial à medida que se aproximam da exaustão em sua busca para completar a jornada antes que as condições sempre cintilantes se voltem irrevogavelmente contra eles .  ",objetiva
2333,embora seja um sorriso ligeiramente torto . ,objetiva
2334,el és formam um partido político por razões táticas . ,objetiva
2335,sandy beata aceita um emprego em uma gravadora independente criada pelo ambicioso empresário bach armstrong . ,objetiva
2336," o herói volta várias décadas em seus pensamentos , ao tempo em que ele era um menino loiro que estava constantemente correndo para algum lugar em busca de algo .  ",objetiva
2337," o filme do experiente diretor de televisão richard pearce ( the right five , crime in the streets , crime miami , medium e outras séries ) foi criado com base no artigo de robert sabia , the invisible family , publicado em number na new york times magazine .  ",objetiva
2338,ele se depara com um elefante gigante preso em uma rede de caça furtiva e o liberta . ,objetiva
2339,mas o cão da cidade não vai desistir assim . ,objetiva
2340,esta série emocionante segue steve em aventuras enquanto ele enfrenta o meio ambiente e os animais enquanto tenta descobrir os exemplos mais incríveis de residência da natureza . ,objetiva
2341," uma mãe doente terminal chamada yvonne é emocionalmente dependente de seu filho adulto michel e não pode deixá-lo crescer e se tornar independente , independentemente de sua idade .  ",objetiva
5912,te en hot certeza que abc boyle adoraria . ,subjetiva
5913, vou pendurar aqui . '  ,subjetiva
5914,todo o esqueleto da narrativa é mal construído . ,subjetiva
5915,então finalmente consegui um longa-metragem de luca a . ,subjetiva
5916,a história como tal não era muito divertida . ,subjetiva
5917,talvez seja uma pena que não houvesse mais na polpa . ,subjetiva
5918,eu não podia acreditar em meus olhos o que aconteceu lá . ,subjetiva
5919," arrastando drama social - se não tivesse nicholson e streep , eu quase me arrependeria das mais de number horas da minha vida .  ",subjetiva
5920," algo como transformers , só que a coreografia é completamente sem ideia , nota benze , completamente inadequada para o primeiro tempo .  ",subjetiva
5921," me és amor que você saiba como tudo vai acabar , o roteiro é bom , a tensão aumenta agradavelmente e o espectador simplesmente gosta .  ",subjetiva
5922,osso e pele do bebê e a imitação de sexo foi muito engraçado . ,subjetiva
5923," é verdade , exceto nos últimos number minutos , quando simplesmente cortei .  ",subjetiva
5924,controlas não são apenas um ato excepcional do ponto de vista técnico . ,subjetiva
5925,ar és para . lança várias ideias interessantes durante a trama . ,subjetiva
5926," e ela espanou não apenas denunciantes vendáveis , mas diretamente aqueles jornalistas vendáveis , aqueles que perseguem os escórias de nossa democleptocracia através do epíteto e do chamado espectro me / ar / dial sério .  ",subjetiva
5927," em termos de gênero , o filme está na fronteira entre uma comédia romântica descontraída e um pequeno drama com elementos ' fi ' , é lindo e na verdade é bem sem confronto .  ",subjetiva
5928," a cena no méxico é boa , mas você só precisa compará-la com a cena da gigante barragem russa por exemplo , para determinar o vencedor , os helicópteros também não são usados ​​corretam en te , lembre-se do salto de brosnan no helicóptero caindo , e assim poderia prossiga .  ",subjetiva
5929," então não era divertido , de alguma forma não tinha nada a ver .  ",subjetiva
5930,eu tenho circulado o doutor por tanto tempo que decidi começar com o number terceiro doutor de matt smith . ,subjetiva
5931," sim , dos number ou mais filmes de amityville que eu vi , não é o pior , e tem uma boa cena aqui e ali , mas é tão cansativo e chato que não é mais surpreendente , e o filme se baseia incrivelmente em sustos falsos , que são terrivelmente estúpidos .  ",subjetiva
5932," o que , claro , não seria tão ruim por si só , eu só esperava algo mais depois da apresentação promissora e das quase duas horas de duração .  ",subjetiva
5933," embora o drama não seja exatamente um gênero que eu procuraria , fiquei muito agradavelmente surpreso com este filme .  ",subjetiva
5934," extração de roteiro de depósitos tchecos de ( e não apenas ) expressões diabólicas , que mereceriam melhor pontuação e ritmo das palavras à imagem , o que éden ok , com a experiência de seu avô , certamente conseguiria fazer melhor hoje .  ",subjetiva
5935," uma produção televisiva muito agradável do conto de herrman , dominada pelas atuações de todos os envolvidos .  ",subjetiva
5936," fiquei literalmente deslumbrado com a música de gabriel troiano , para dramas de amor trágicos , seu acompanhamento é simplesmente perfeito e de tirar o fôlego ( por exemplo - the english patient ) , ele sempre cria uma atmosfera tão interessante , e quando as composições às vezes são misturadas com trechos de poemas , definitivamente afeta minhas emoções .  ",subjetiva
5937," te - lo em suas mãos sem besteira , alguém precisa de barman , poderia ter sido um filme decente sem tantos clichês  ",subjetiva
5938," o filme é dedicado a adam mcduffie ( number ) , roteirista e produtor da série liga da justiça .  ",subjetiva
5939," é só que quando eu sei que um avião vai decolar do solo a cerca de number quilômetros / hoje e um fragmento médio do exército ( que fica feliz em fazer cem ) e duas ou duas latas de lixo da polícia estão dirigindo junto com ele na foto , eu sentir-se fraco e triste .  ",subjetiva
5940," apo en as alguns vislumbres , como cenas com uma mãe demente que acredita fortemente em algum poder maligno ou algo assim .  ",subjetiva
5941," não se trata de execução ou tortura , e na verdade é sobre uma luta entre o bem e um bruxo do mal nos locais da rússia nevada e são petersburgo e depois paris na década de number .  ",subjetiva
5942," e diálogos estúpidos , como escreve radinho , não mais .  ",subjetiva
5943," então , se necessário , editarei a classificação e felicitei um comentário .  ",subjetiva
5944," no meu perfil , afirmo que não gosto de filmes de ação , mas na verdade isso não é totalmente verdade , haveria uma série de exceções que confirmam a regra .  ",subjetiva
5945," a versão coreana é provavelmente um pouco melhor , mesmo que seja apenas pelo motivo de ser um filme e não dividido em duas partes como fingersmith .  ",subjetiva
5946,uma história terrivelmente legível sem quaisquer reviravoltas . ,subjetiva
5947," mas aqui temos um roteiro caoticamente editado , que se manifesta no fato de que a dupla de heróis principal está batendo de cinco a nove , suas chamadas não movem o filme em qualquer lugar e parecem pura improvisação .  ",subjetiva
5948," se fosse verdade ( e provavelmente não precisa ser ) , não faria sentido encobrir algo , e petar abóboda não estaria brincando com nada .  ",subjetiva
5949,a ação é dinâmica e bastante eficaz em 3d . ,subjetiva
5950,a parte que todos esperavam há tanto tempo . ,subjetiva
5951,nem mesmo jodorowsky se envergonharia desse grande tédio . ,subjetiva
5952,a história que flui lentamente progride inexoravelmente para um fim trágico . ,subjetiva
5953,eu vi esse episódio quando era muito jovem na casa da minha avó e foi uma das maiores bombas que vi na época . ,subjetiva
5954," o enredo é muito simples , mas magistralmente retratado .  ",subjetiva
5955," quando criança , eu costumava ser muito louco por cachorros , então qualquer coisa em que um cachorro aparecesse era algo maravilhoso para mim .  ",subjetiva
5956," o que me incomodou um pouco foi o organizador muito intrusivo da partida , que era pra ser engraçado , mas na minha opinião ele exagerou .  ",subjetiva
5957,eu também gostaria de mostrar o dedo do meio ao diabo quando eu for para o céu :-) ,subjetiva
5958,um dos filmes que eu esperava há muito tempo . ,subjetiva
5959," infeliz en te , isso também é uma realidade em nosso país , e cada um de nós vai lidar com isso .  ",subjetiva
5960," na minha opinião , este conto de fadas não fez muito sucesso para o roteirista e diretor em uma pessoa .  ",subjetiva
5961,uma grande surpresa em nossas terras de conto de fadas . ,subjetiva
5962,* * * resumindo : ninguém nota um cadáver no metrô . ,subjetiva
5963," é uma pena que lenis a , o ator mais persistente , nunca tenha feito outro filme depois disso .  ",subjetiva
5964,eu já vi cerca de number vezes agora e não consigo imaginar ficar entediado . ,subjetiva
5965,uma ideia muito boa com um triângulo amoroso executado de maneira tipicamente chinesa com longas tomadas de câmera e diálogo mínimo . ,subjetiva
5966," um filme que tem um pouco de tensão , não é um filme de terror , o enredo é bem estranho , o enredo se arrasta desnecessariamente , apenas talvez a música retrate a atmosfera sombria do filme , senão nada de abalar o mundo , a mistura de duas pessoas , em duas fases do filme , a classificação corresponde totalmente .  ",subjetiva
5967,esse estilo de contar histórias era perfeito . ,subjetiva
5968," rápido , engraçado , não há longas passagens chatas onde nada acontece .  ",subjetiva
5969,gostei muito do filme e dou number :) ,subjetiva
5970," e em total solidão o sinal se desvanece , cada vez mais silencioso , mas ainda bastante distinto .  ",subjetiva
5971,o caso exorcista me excitou totalmente com a câmera trágica durante os interrogatórios . ,subjetiva
5972," então , no futuro , terei muito cuidado para que nós ( larry clark e eu ) nunca mais nos encontremos ! ! !  ",subjetiva
5973," me és amor que a engenhosidade técnica encurte as viagens entre os continentes , o méxico , por exemplo , ainda está longe demais para que possamos formar uma imagem clara dele com as possíveis correções frequentes que o tempo e seu desenvolvimento exigem .  ",subjetiva
5974," o filme definitivamente está indo não só graças aos diretores , mas principalmente por causa do casal principal bridges-damon e suas performances absolutamente divinas aqui , não tenho nada a reclamar .  ",subjetiva
5975," como ator , não é apenas um prazer olhar para pepe , mas também para todo o outro conjunto liderado por densa studenková e não terminando com milan básica .  ",subjetiva
5976,para en a que lexia não cortou essa inutilidade . ,subjetiva
5977," se a imagem tivesse number minutos , funcionaria da mesma forma .  ",subjetiva
5978," mas para não prejudicar o filme , foi interessante em alguns momentos e , sobretudo , nunca tive vontade de desligar o filme .  ",subjetiva
5979," os usuários locais criticam muito o filme , mas também não merece mais do que três estrelas .  ",subjetiva
5980,só não gostava da relação entre pai e filho . ,subjetiva
5981," sua presença certamente tem um impacto fatal no andamento mencionado anteriormente , que gradualmente desaparece completamente .  ",subjetiva
5982," a última meia hora salvou este pequeno do lixo , porque embora a ação seja bastante chata , pelo menos há alguma .  ",subjetiva
5983," dois atores populares nos papéis do ' casal ' central , um diretor experiente no gênero , um assunto bastante não convencional .  ",subjetiva
5984,prefiro pesquisar no google baila na vilipendia . ,subjetiva
5985," para és soam en te , dou três estrelas com o fato de que tenho que elogiar o senhor . oral por sua coragem e por uma tentativa pouco convencional .  ",subjetiva
5986," este é um verdadeiro tesouro cinematográfico , a partir de hoje vou assistir emma e os seis pontos duas vezes por dia .  ",subjetiva
5987," anta és do meu comentário , vou tentar explicar o meu crepúsculo mental que me fez assistir a isso .  ",subjetiva
5988,espero que os quadrinhos de moore sejam completamente diferentes . ,subjetiva
5989,esperava mais de clark depois de uma estreia promissora . ,subjetiva
5990, os coes ' atiram ' completamente fora de mim desta vez .  ,subjetiva
5991,o poder da amizade masculina é talvez o mais forte de todos os trabalhos de pechinha neste filme . ,subjetiva
5992," qualquer cara pode mexer com a cabeça de uma mulher , só não sabe !  ",subjetiva
