,FRASE,OBJ/SUBJ
1713,os autores de lapidário conseguiram traçar o destino de um par de esquis e sua curiosa jornada por mercador até abalone nada bisou . ,objetiva
1714," ele conhece chairo hawaii , um estudante não tão rico da universidade de tóquio , que é um dos candidatos a um emprego em sua empresa .  ",objetiva
1715," a série de desenhos animados em sete partes do singular diretor e artista václav merge está repleta de ideias que pala merglová , esposa e colaboradora do diretor , já concebeu no cenário literário .  ",objetiva
1716," anta és de ter um derrame , ele estava ativamente envolvido no mergulho .  ",objetiva
1717," ao longo do caminho , ele para em um pequeno bar onde conhece lola , uma jovem que mora em uma fazenda da família não muito longe .  ",objetiva
1718," charla és berkeley , da child welfare , chega à comunidade .  ",objetiva
1719," ocorreram em budapeste em number , quando uma certa maria ferrete escapou de um bordel local .  ",objetiva
1720," três séculos antes , porém , os estudantes defenderam praga contra os suecos e duzentos anos depois contra windischgr tez .  ",objetiva
1721," todos ficaram horrorizados , apenas frank saiu do carro e foi examinar o corpo de perto .  ",objetiva
1722," eva en atual en te , ela começa a se candidatar ao cargo de chefe de cozinha , mas não consegue porque é da raça e gênero ' errados ' .  ",objetiva
1723," o próprio telescópio hubble foi reparado e mantido várias vezes , mas algo assim era impensável no caso de roseta .  ",objetiva
1724,a história de detetive baseada no conto de ea poe foi escrita por já . knitlová . ,objetiva
1725,não há dúvida de que a raça humana será exterminada em poucos dias . ,objetiva
1726," apo en as dois meses após seu casamento , a bela jovem yeon-yi está atormentada ; depois de um trágico acidente de carro , seu marido jin-woo permanece em coma .  ",objetiva
1727,o silêncio e o silêncio tinham o mesmo poder destrutivo que a geada amarga do lado de fora das janelas das casas . ,objetiva
1728," ela precisa de tempo para resolver tudo , então vai passar o verão com sua avó maravilhosa , na cidade onde passou a maior parte de sua infância quando sua mãe deixou de cuidar dela após o divórcio .  ",objetiva
1729,ela o traz para os balins e quer que ele diga a verdade . ,objetiva
1730,ele transferiu com sucesso sua propensão para ações cuidadosamente fotografadas e cenas em câmera lenta de violência brutal para um cenário ocidental com orçamentos significativamente mais altos . ,objetiva
1731,mark henry dá uma excelente atuação no thriller repleto de ação baseado no lendário videogame . ,objetiva
1732,veremos cenas malsucedidas e como todo o filme foi criado . ,objetiva
1733," ele costumava temer o xerife jp harrah , mas agora o xerife caiu no alcoolismo , então jason está mais uma vez procurando por pistoleiros para sua pequena guerra contra os mcdonalds .  ",objetiva
1734,mia pode ficar animada com qualquer coisa e qualquer um em um instante . ,objetiva
1735," ele , portanto , pede a ajuda de um mcdonald experiente .  ",objetiva
1736," quando seu namorado e escritor garth termina com ela antes do natal , ele a deixa saber que ela não é boa o suficiente para ele .  ",objetiva
1737," um filme sobre um grupo de homens idosos em busca de relaxamento , realização de sonhos e fuga da rotina da vida no jazz .  ",objetiva
1738,o rei abo divo e a rainha elizabeth vivem uma vida linda . ,objetiva
1739," paul sheldon ( jam és alan ) é um escritor de sucesso que é mais conhecido por uma série de romances com o mesmo personagem principal , misera .  ",objetiva
1740," as vidas do doutor . irving , com quem nadia falou pouco antes sobre os efeitos físicos da explosão , assim como a cantora judy , que ao mesmo tempo está gravando um novo álbum com o pianista de jazz john medes , se entrelaçam e passam com seus destinos em um frágil mosaico cinematográfico .  ",objetiva
1741,todo criador pode participar do programa com seu curta-metragem . ,objetiva
1742," seu peculiar relacionamento romântico começa com uma mordida no pescoço e continua com a desagradável percepção de ian de que ele acaba de se tornar membro de uma pequena comunidade de criaturas da noite , vampiros , liderada pelo veterano jesse ( lance henriksen ) .  ",objetiva
1743," portanto , o ' adocem en etário ' susumu hani foi contratado para dirigir essa ' reconstrução ' .  ",objetiva
1744,o que acontece quando um porco doméstico tão comum descobre que ele é um cantor e ator incrivelmente talentoso ? ,objetiva
1745," cegonha não cegonha , pardal não pardal , richard não tem asas à toa e parte sozinho para a áfrica distante .  ",objetiva
1746," se o político não seguir as instruções dos sequestradores , sua filha morrerá .  ",objetiva
1747," dois jovens amantes , o cantor de ópera e católico robert e a solista de violino judia rachel , sonham em um dia se apresentarem juntos no lendário carnei hall .  ",objetiva
1748," é uma co-produção completamente única de quatro estações de televisão públicas europeias – televisão checa , órfã austríaca , artes eslovaca e mova húngara .  ",objetiva
1749," o popular escritor policial harrison boyle deve contratar uma guarda-costas , a sexy policial nikki , para protegê-lo de seus fãs .  ",objetiva
1750,bem - vindo a um mundo onde nada é o que parece e ninguém pode ser confiável . ,objetiva
1751," o spirit of adventure é um desses navios e chris perle aproveita para descobrir os encantos da costa rica , panamá e do arquipélago de san balas , no caribe .  ",objetiva
1752," em number , já se passaram number anos desde a estreia de uma das séries de televisão de maior sucesso , sinal people of the city of pague .  ",objetiva
1753,o garoto conseguiu fazer com que um dos motores falhasse e a máquina teve que fazer um pouso de emergência em los angeles . ,objetiva
1754," a história se passa em um futuro próximo na cidade fictícia de maleta imersa em uma guerra de gangues , onde o dinheiro é mais valioso que a vida humana , o amor ou a amizade .  ",objetiva
1755," que és toa és de sexualidade são tratadas muito abertamente , então o filme às vezes é chamado de pornográfico , o que é completamente errado .  ",objetiva
1756,e dentro dele se esconde o lugar mais profundo da terra . ,objetiva
1757," a atenção é dada principalmente aos grupos musicais que surgiram no referido período , como na canção vagabunda do grupo sepultura e hop-trop .  ",objetiva
1758," quando ela descobre que está grávida , seu desespero só aumenta .  ",objetiva
1759,sua imprudência em novas ações e indecisão resultaram em ele não ser bom para o céu e ruim para o inferno no cômputo final . ,objetiva
1760," naquele mesmo dia , o irmão com quem ele mora quer o aluguel dele , mas dewey não tem dinheiro .  ",objetiva
1761,ivan pode deixar seu melhor amigo para uma vida feliz na natureza ? ,objetiva
1762,tommy então encontra o corpo sem vida do menino debaixo d'água . ,objetiva
1763," um colega casado ( já . aufere ) a ultrapassa no banco de poupança , mas ela resiste .  ",objetiva
1764," uma emocionante e mágica aventura conta a história do americano mickey miller , de doze anos .  ",objetiva
1765,comédia de situação dirigida por rudolf havlík e escritor radia třeštíková . ,objetiva
1766,a ema está realizando um concurso e o vencedor recebe um convite para toda a escola para uma festa na ilha com celebridades . ,objetiva
1767," ele conseguiu um de seus primeiros papéis no filme agora lendário com john wayne , the green bernes .  ",objetiva
1768," enquanto a jovem família está tendo dificuldades para se acostumar com a nova situação , outro golpe vem - ben tem que voltar para a frente .  ",objetiva
1769," após uma série de assassinatos brutais e inexplicáveis ​​em uma floresta remota e inacessível , uma unidade militar investiga .  ",objetiva
1770," exaustão , humilhação e traição trazem um fim imprevisível .  ",objetiva
1771," são exemplos excepcionais de arquitetura , a expressão mais avançada da habilidade técnica daquele tempo e lugar .  ",objetiva
1772," mas para que ela tenha sucesso , ela deve parar o implacável limpa-neves .  ",objetiva
1773,agora apenas number como resultado da caça ilegal e perda de fauna . ,objetiva
1774," o filme é sobre uma garotinha , angélica , que perdeu os pais durante a guerra .  ",objetiva
1775," no entanto , penas altas para delitos banais , das quais toda a máquina judiciária vive , são automaticamente reduzidas ou perdoadas se os réus confessarem - a porcentagem de crimes resolvidos em bogotá é , portanto , muito alta .  ",objetiva
1776," a vida de amir , de trinta anos , é dominada pelos problemas dos outros .  ",objetiva
1777," o filme de propaganda ( oficial en te credenciado pela luftwaffe ) segue o destino de três esquadrões , armados com os famosos bombardeiros de profundidade estua , tanto em combate quanto em segundo plano .  ",objetiva
1778," no filme , acompanhamos duas equipes - uma interessada sociologicamente por moda , gosto e hábitos de vestuário ;  ",objetiva
1779," a atmosfera da alemanha nazista em todo o seu orgulho inchado e agressivo atinge o espectador com uma força avassaladora , que é excelentemente auxiliada pela câmera de gajos soltai , que deliberadamente evita o realismo da impressão colorida .  ",objetiva
1780," enquanto isso , kate decide procurar sua mãe .  ",objetiva
1781," bravos marinheiros lutarão contra criaturas místicas e se reunirão com aslan , o leão , em uma missão cujo resultado determinará o destino de toda canária !  ",objetiva
1782," enquanto o sol se erguia cada vez mais alto , ambos sentiam que a fronteira que separava os dois mundos estava se tornando mais concreta , que não havia caminho de volta , que tudo era irreversível e só restava esperar a renovação .  ",objetiva
1783," a história do caso de amor de eller com aba , uma estudante de intercâmbio japonesa que ele conheceu anos atrás na américa , também é significativa .  ",objetiva
1784,a revista é criada em cooperação com estudos regionais . ,objetiva
1785,ela tinha que ir atrás dele rapidamente . ,objetiva
1786," ele finalmente consegue escapar para a bélgica , onde aprende a falar novamente com a ajuda de uma organização sem fins lucrativos para solicitei o status de refugiado .  ",objetiva
1787,no princípio deus criou os céus e a terra . ,objetiva
1788,mas a primavera está começando e o boneco de neve corre o risco de se dissolver . ,objetiva
1789," bem , certamente não desejamos que você se divirta assistindo a esse programa .  ",objetiva
1790," o primeiro filme pornô distribuído legalmente nos eua , que também se tornou um símbolo da década .  ",objetiva
1791," e da mesma forma , the earth from above também é o nome de uma de suas quase sessenta publicações que publicou durante sua carreira ativa .  ",objetiva
1792,ele mostrará de onde vêm as plantas de natal mais populares e como elas podem ser úteis para nós durante as férias . ,objetiva
1793," este filme vencedor do oscar ® ( melhor filme , number ) , no qual a própria dormis day canta canções de época de maneira extraordinária , é baseado na dura história da vida de ruth com um homem que ajudou sua carreira com seus métodos violentos enquanto a sufocava com sua impulsividade obsessiva , da qual ela escapou apenas pelo preço de um grande perigo .  ",objetiva
1794," a recompensa por sua cabeça continua aumentando , e é apenas uma questão de tempo até que os destinos dos ex-amigos se cruzem novamente .  ",objetiva
1795,robert e victoria encontram assim uma passagem secreta que os leva ao palácio papa . ,objetiva
1796," no cinéfilo de ação , você encontrará uma história de amor , morte , traição , mas acima de tudo , muitas lutas sangrentas .  ",objetiva
1797," el és ignoram as instruções dos ambientalistas e embarcam em experimentos arriscados que ativam uma onda de tsunami , que impede um paraíso pitoresco cheio de turistas e nativos .  ",objetiva
1798," portanto , ele deve se vingar mesmo com seu handicap .  ",objetiva
1799," não és se momento , monica percebe que bruce ainda se preocupa com hilary .  ",objetiva
1800," rose intervém e salva o político após um tiroteio selvagem , embora ele tenha que jogá-lo de uma ponte em um rio no processo .  ",objetiva
1801,as calças boca de sino e as criações de dança selvagens com as quais javari intercalava suas performances foram interrompidas pela nova situação política . ,objetiva
1802," as lojas de departamento estão se enchendo , as pessoas estão comprando presentes e pensando cuidadosamente sobre o que não devem esquecer durante todos os preparativos .  ",objetiva
1803," para os mergulhadores , a grande barreira de corais é uma meca , um lugar que todos devem visitar .  ",objetiva
1804," el és falam de pessoas cujas histórias e destinos pessoais se entrelaçam com o destino da sociedade , determinado pelas mudanças dos tempos .  ",objetiva
1805,robalo leva a viagem e toda a estadia com o pai com muita dificuldade . ,objetiva
1806," sua filha pedi afã é convidada para a aula de dança do clube kraft , onde conhece jejuará , um estagiário clerical .  ",objetiva
1807," no entanto , quando a arca se afasta , finita e lea acidentalmente não estão nela .  ",objetiva
1808," na argélia dos anos number , o oficial francês meursault leva uma vida bastante estereotipada .  ",objetiva
1809," no decorrer de um filme muito imaginativo do estúdio de um dos mais proeminentes cineastas latino-americanos , no qual não faltam interessantes trabalhos de câmera , humor , música impressionante e jogos originais com a imagem , podemos observar como os pobres irmãs gradualmente se tornam estrelas .  ",objetiva
1810,e isso pode ser muito perigoso . ,objetiva
1811,vamos dar uma olhada juntos nos negócios em alta nos tempos do maior boom desde a revolução de veludo . ,objetiva
1812," a equipe de filmagem francesa obteve permissão para entrevistar três dessas mulheres no arizona e no texas , revelando suas histórias emocionantes e um vislumbre da vida cotidiana no corredor da morte .  ",objetiva
1813,a história das tropas americanas nas batalhas da guerra da coréia . ,objetiva
1814," em frágeis pontões e barcos de pesca , eles cruzam o dnieper e inexoravelmente avançam para oeste .  ",objetiva
1815," quando parnasos ouve esta notícia de sua , ele se joga do penhasco .  ",objetiva
1816," após o baile anual , a sobrinha de reza , toni afã , fica noiva de inca .  ",objetiva
1817,a história baseada no conto do escritor russo daniel charms é transportada no espírito da imaginação infantil e do humor absurdo . ,objetiva
1818," ele tem onze álbuns auto-intitulados , música para filmes e produções teatrais e um papel no filme de hebe beauty in trouble .  ",objetiva
1819," as antipatias mútuas se transformam em simpatia durante essas manobras e , mesmo que seu plano miseravelmente ao longo do caminho , eles não são mais sogro e sogra no casamento dos filhos , mas um casal apaixonado .  ",objetiva
1820," recebeu o nome do hospital local ( construído no modelo da mesma instalação em estocolmo ) , e se queremos saber o significado do próprio nome , é derivado do nome da deusa escandinava da saúde edir .  ",objetiva
1821," mais do que uma conquista física , esta expedição é um sonho tornado realidade e uma celebração da natureza .  ",objetiva
1822," o documentarista vencedor do oscar , alex disney , testemunha urgentemente o fracasso fatal do governo dos eua diante da doença covil number .  ",objetiva
1823," em number , este oásis de liberdade e cultivo da língua bielorrussa foi banido .  ",objetiva
1824," amanhã eles parecerão bonitos para você , depois de amanhã magistral ' .  ",objetiva
1825," tudo o que você precisa fazer é pesquisar , pensar e cooperar , e quem sabe , talvez essa fuga da prisão de nana seja realmente bem-sucedida um dia .  ",objetiva
1826," mas , em vez disso , ele se envolve nas armadilhas das paixões e fantasias da mulher , o que perturba completamente sua vida real .  ",objetiva
1827," claro , o famoso nativo britânico alfred hitchcock ou a atriz internacional dolores interpretou também são mencionados .  ",objetiva
1828,todos os estados do mundo devem unir forças para enfrentar um inimigo muitas vezes mais avançado . ,objetiva
1829," mature en e joe hannigan , um casal piedoso e exemplar , são assassinados em sua própria casa .  ",objetiva
1830," quatro anos depois , a dupla ganhou um oscar pela música lie slowly .  ",objetiva
1831,mas nem todos esses animais se assustam com a visão de montes de neve de um metro de comprimento ou frio e geada de arrepiar os ossos . ,objetiva
1832," tocante és , bizarros , cheios de reviravoltas e surpresas , assim são os episódios da série sala number , que trazem novas descobertas semana após semana e contam histórias de pessoas comuns em busca de conexão e significado .  ",objetiva
1833," os ouvintes têm a oportunidade nas instalações históricas do castelo , a igreja de sim . dilui , o teatro já tal ou o antigo quartel teresiánské para passar noites agradáveis .  ",objetiva
1834," animais de fazenda experimentam as mesmas emoções que nós – medo , contentamento , dor , alegria , tédio .  ",objetiva
1835,seus colegas o parabenizam e o velho contador anote leva seu extrato bancário ao seu superior . ,objetiva
1836,os cientistas então encontram algo chocante nos restos mortais das vítimas dilaceradas . ,objetiva
1837,e foi exatamente isso que aconteceu com o herói deste filme . ,objetiva
1838,meti é posteriormente transportado para los angeles . ,objetiva
1839," no início , apesar da situação , eles se entendem e tentam se ajudar em tudo .  ",objetiva
1840," além do sexo chocante , várias sensações escandalosas se tornaram a base do sucesso de todos os outros números . filipino e alhear se apaixonaram em um casamento não convencional e se mudaram para uma luxuosa mansão em um estilo adequado para um magnata da pornografia .  ",objetiva
1841,os motores serão menos potentes e as pistas de corrida menos perigosas . ,objetiva
1842," a orquestra de václav hebe a toca , a coreografia de dança foi criada por milena moravcová .  ",objetiva
1843," quatro correntes religiosas – hinduísmo , japonismo , budismo e sionismo – ajudaram a criar aqui , que aqui surgiram ao longo da história e deixaram vestígios indeléveis .  ",objetiva
1844," mas não há resposta certa para a pergunta aparentemente fácil - laura é surda e resignada com seu destino , ela se opõe à operação .  ",objetiva
1845,sua luta diária pela sobrevivência cria um forte vínculo entre eles e suas vidas de repente fazem sentido . ,objetiva
1846," a verdadeira sabe city tem apenas dezenas de moradores permanentes , mas na temporada , milhares dos chamados snowbirds , boêmios dos estados do norte dos eua , chegam ao local em busca de calor .  ",objetiva
1847," ao longo do caminho , eles encontram uma série de acidentes e inconvenientes - incluindo carros roubados , tentativas fracassadas de cometer crimes graves , encontros inesperados com carneiros e vidas salvas por acaso .  ",objetiva
1848,o rei do bolo buddy alastro visita padarias falidas para ajudar a reviver um negócio outrora próspero . ,objetiva
1849,é o amor verdadeiro que deu errado ? ,objetiva
1850," a comédia americana conta a dolorosa jornada de um casal apaixonado até o dia do casamento dos sonhos , que , claro , deve ser perfeito e sua data corretamente cronometrada .  ",objetiva
1851," alex rebe apresenta um famoso programa de televisão com uma história excepcionalmente longa , no qual um trio de jogadores aplica seus conhecimentos de história , arte , cultura popular e outros campos .  ",objetiva
1852," juntos , eles trabalham para chegar à verdade , o que às vezes dói .  ",objetiva
1853," sara e onda logo começam a desenvolver uma relação mais do que amistosa entre elas , que , no entanto , é dificultada pela chegada de pavel ( pavel ver ) de volta ao coral , que chama toda a atenção de sara para si .  ",objetiva
1854,ele pode provar que foi uma boa pessoa em sua peregrinação ou cairá no inferno ? ,objetiva
1855," quase três anos de coleta de material no interior da república tcheca , investigando com que temas os agricultores e empresários desta área convivem , como e por que os subsídios funcionam , por que algumas culturas são cultivadas mais e outras menos , e por que a criação de animais diminuiu nos últimos anos e o que consequências que isso tem na produção de alimentos , levou os autores no corte final a se concentrar no papel de andrei babi a , o estilo e as consequências de seu negócio e , posteriormente , também suas atividades políticas , que se tornam um dos fatores mais determinantes para a paisagem tcheca , o ambiente de negócios e em breve muito provavelmente também para todo o estado .  ",objetiva
1856," quando a própria família de manar começa a ameaçar machucá-la se ela sair com o namorado em público , carecem deve decidir rapidamente se segue a tradição conservadora ou defende a mulher que ama e o artista que respeita .  ",objetiva
1857,o veneno do mais venenoso pode matar um cavalo em cinco minutos . ,objetiva
1858,o documentarista desaparece e os outros percebem que devem enfrentar os fantasmas do passado . ,objetiva
1859," dez pessoas que não se conhecem são convidadas para uma ilha isolada por seu dono extravagante nana shin , que nenhum deles jamais conheceu .  ",objetiva
1860," assim , o detetive benoit se envolve em um jogo muito perigoso com pessoas que estão determinadas a capturar o falcão por qualquer meio disponível .  ",objetiva
1861,o documentário sobre o teatro taiwanês contemporâneo é marcante justamente pela escolha de seus principais protagonistas . ,objetiva
1862," um século termina , o que o próximo trará ?  ",objetiva
1863," em sua jornada pela selva , eles lutam contra a fome , a exaustão e a hipotermia .  ",objetiva
1864," por causa de seu seguro , muitas pessoas perderam suas casas , empregos ou entes queridos .  ",objetiva
1865," ator en andado , sam decide ir ao fundo das coisas investigando por conta própria .  ",objetiva
1866," o tesouro que não cheira trata do significado biológico , psicológico , etnológico , histórico , científico , econômico , social , cultural e ecológico dos dejetos humanos e animais .  ",objetiva
1867,o ́banion e a guerra de gangues eclodiram . ,objetiva
1868," harold não apenas entende o significado dos sentimentos , do amor e da lealdade , mas até encontra um gosto neles e está no melhor caminho para trair sua missão interplanetária .  ",objetiva
1869," me és amor estudar em uma universidade não protege contra a tentação - o jovem herói deixa de distinguir a linha da lei , mas , surpreendentemente , nem a educação o ajuda a detectar a fraude cometida contra ele a tempo .  ",objetiva
1870," não és te filme , altman não está tão interessado nas acrobacias violentas de gângsteres , mas está mais interessado em seguir a história da vida cotidiana de seus heróis do cinema , que ele não glorifica em nada .  ",objetiva
1871,as criaturas mais perigosas podem desafiar sua imaginação . ,objetiva
1872," no conto das três princesas encantadas , honda decidiu relaxar um pouco e ter umas férias maravilhosas .  ",objetiva
1873," seu único amigo é um colega mais velho da escola , reside , que sabe o que incomoda alina e o que faz com que seus resultados escolares se deteriorem .  ",objetiva
1874," ele já tem quase tudo , então anseia por uma família que ele criará à sua maneira .  ",objetiva
1875,o filme de graduação de jack brown usa a estética dos road games americanos . ,objetiva
1876," mostra - nos quanto trabalho e cuidado o diretor dombrovskij dedicou a cada membro da trupe de ópera , a cada performance de canto e atuação , a cada cena , para que o resultado fosse o mais perfeito e verdadeiro possível .  ",objetiva
1877," ele acredita que pode convencer o regime totalitário dos benefícios do contato com o estilo ocidental , assim como os entediados consumidores de arte europeus ganharão novos motivos para pensar graças ao encontro com uma mentalidade diferente .  ",objetiva
1878," agora , quatro anos depois , chris retorna a londres e descobre o quanto suas vidas mudaram em um dia .  ",objetiva
1879," ao longo do caminho , eles experimentarão uma série de encontros inesperados , surpresas e obstáculos com os quais terão que lidar .  ",objetiva
1880,kim possible é uma comédia de aventura sobre uma típica colegial que passa seu tempo livre salvando o mundo dos vilões . ,objetiva
1881," quando o herói do filme de aventura em duas partes nasceu , ele foi deixado abandonado no porto de xangai .  ",objetiva
1882,isso se torna realidade quando um homem é morto a tiros na porta da casa de nickname em pouco tempo . ,objetiva
1883," no final , ele consegue encontrar e libertar seu amigo .  ",objetiva
1884," quando eu tinha number anos , meus pais e joe me tiraram da escola por um ano , lembra hannah .  ",objetiva
1885,o trio também trabalhou em conjunto nos filmes edna rua neles ( number ) e grandote ( number ) . ,objetiva
1886," a jovem estrela em ascensão renato pobretão apresenta uma antologia das melhores cenas do cinema italiano produzidas pela ' te it anus produtivos ' entre number e number , os anos da primeira época de ouro da história do cinema italiano .  ",objetiva
