,FRASE,OBJ/SUBJ
2343,precisa de um lugar para se esconder quando o mundo dá errado ? ,objetiva
2344," digne caber se apaixona por sua empregada , a jovem concita .  ",objetiva
2345," part és individuais exploram os mistérios das maravilhas antigas e modernas , desde o poderoso romano von na alemanha até as esculturas da ilha de páscoa .  ",objetiva
2346," e já vodka está aqui novamente , com muitas descobertas interessantes esperando por ela !  ",objetiva
2347," no entanto , ao instalar a decoração , ele acidentalmente derruba um dos frascos de seu pai , derramando o conteúdo em suas mãos .  ",objetiva
2348," embora o campo da tecnologia da informação tenha sido fundado por mulheres programadoras , essa parte da história é amplamente ignorada , ou mesmo deliberadamente mantida em silêncio .  ",objetiva
2349,a conversa foi gravada secretamente em um celular e serve de roteiro para modelos animados de situações e interpretações dos atores daquela noite . ,objetiva
2350," portanto , não é à toa que seu filho também se chama elvis .  ",objetiva
2351," todos têm a chance de ganhar - dançarinos talentosos , cantores , acrobatas , malabaristas , mágicos , dublês , comediantes , recitadores , imitadores , e crianças , adolescentes , adultos e idosos competirão .  ",objetiva
2352," ele nunca duvida de si mesmo , nunca perdoa .  ",objetiva
2353,por que ele nunca conheceu jean-paul condado pessoalmente ? ,objetiva
2354," infeliz en te , ele não tem tempo para dar conselhos educacionais importantes a branca de neve , que é a razão de sua popularidade .  ",objetiva
2355," me en os de cem anos após a criação do romance , ele pediu uma palavra e um filme , o monstro ameaçador foi interpretado , por exemplo , pelo famoso ator camaleão robert fonda .  ",objetiva
2356,uma princesa gananciosa de conto de fadas quer se casar com um rei rico e não está interessada no fato de um solteiro comum chamado dupla estar interessado nela . ,objetiva
2357," em ' the elástico ' o ladrão benday quer voltar ao seu ofício logo após sua libertação , mas sua tentativa termina tragicamente .  ",objetiva
2358," como a sociedade responde ao crime , com que severidade os crimes devem ser punidos ?  ",objetiva
2359," a música de alta qualidade apresentada por artistas conhecidos , combinada com a atmosfera acolhedora e íntima da praça ou castelo de bebo , garante experiências inspiradoras inesquecíveis para os visitantes do festival noturno de třeboňská todos os anos .  ",objetiva
2360," abo tentou denunciar os erros de seu pai à polícia antes , mas ninguém acreditou nele .  ",objetiva
2361,o thriller francês manhunt é baseado em fatos reais e no testemunho de um participante direto no ataque a jacques destine . ,objetiva
2362," por um lado , o herói descobre o amor , anseia pela felicidade pessoal , por outro , encontra corrupção e diferenças de classe profundamente enraizadas .  ",objetiva
2363,a magia de um momento na vida de uma velha senhora . ,objetiva
2364," até margo , como uma italiana orgulhosa , está disposta a sacrificar tudo pelo seu país , e não só pelo país .  ",objetiva
2365," já passou do horário de expediente e ela está ocupada com o inseguro frank ( olivier bondade ) , que pratica com ela .  ",objetiva
2366," ( tecia garrett ) está em busca de vingança e vai para o méxico para convencer o irmão de john , louis , a amarrar os broncos uma última vez e ajudar a salvar a cidade .  ",objetiva
2367,el és não escondem sua atitude e tratam as vítimas com insensibilidade . ,objetiva
2368," essa intervenção , graças a conheço , ativista de direitos humanos , custará a andré seu lugar , e o coronel nascimento é liberado com uma promoção .  ",objetiva
2369,gravação da turnê up at the lake da banda britânica de indie-rock the charlatães . ,objetiva
2370," mas o filhote se tornará um animal real , uma leoa fofa se tornará um leão forte e incrível .  ",objetiva
2371," em algumas décadas , haverá mais de dez bilhões de pessoas na terra .  ",objetiva
2372," no entanto , vários dias após o incidente , ainda não há relatos da mídia sobre o assassinato , como se nada realmente tivesse acontecido .  ",objetiva
2373,o que acontece quando o gatilho estala na frente de seus olhos e uma bala de um revólver entra em sua cabeça ? ,objetiva
2374," através dos olhos de pacientes , seus entes queridos , terapeutas e pesquisadores , ele explica como o uso de licitas em um ambiente controlado ajuda a reduzir a ansiedade psico-espiritual , a depressão e a dor física .  ",objetiva
2375," a série é dirigida por vladimir braz e as letras são escritas por jia ai sê-la reik , um ator do teatro nacional da morávia-silésia .  ",objetiva
2376," de devaneios a transtornos de ansiedade , a série educacional explica de forma envolvente como o cérebro funciona .  ",objetiva
2377," o que implica o nascimento de uma criança , como cuidar de um bebê e o que fazer com as crianças quando elas começam a crescer além de nossas cabeças ?  ",objetiva
2378,mas nada disso é o motivo de seu mau humor . ,objetiva
2379," não é uma mera narrativa descritiva , mas uma releitura poética de destinos humanos dramáticos que entraram em conflito com o poder , a violência e a crueldade .  ",objetiva
2380,a juventude de ouro de praga conhece o outro lado da vida . ,objetiva
2381," dois anos ensaiando , tocando e filmando as sinfonias e concertos de devo baku realizados pela filarmônica tcheca com o maestro principal jia ai bělohlávek .  ",objetiva
2382,ele foi encontrado baleado no local da troca . ,objetiva
2383," juntam en te com outra policial , eles estão esperando por um perigoso assassino em um salão de dança .  ",objetiva
2384,a narrativa é baseada na personagem de uma filha que sofre um trauma grave na infância e que decide lidar com isso de forma radical . ,objetiva
2385,fotos estáticas compostas com precisão são capazes de capturar e apoiar o choque nítido entre o antigo e o novo modo de vida e suas consequências dramáticas . ,objetiva
2386," repor és en tanto és de grupos mafiosos que comercializam drogas estão muito insatisfeitos com sua proposta , pois podem perder uma quantia significativa de dinheiro .  ",objetiva
2387," são os personagens originais que se desviam dos estereótipos comuns de gênero , gênero ou idade que talvez sejam o ponto mais forte desta nova série .  ",objetiva
2388," mas nenhum deles tem ideia do que o futuro trará , onde viverão ou como ganharão dinheiro .  ",objetiva
2389," além dos prêmios europeus , a ema também anuncia os melhores artistas americanos .  ",objetiva
2390," te en hot trinta anos - a vida é uma merda , mas o copo ainda aguenta .  ",objetiva
2391," urotsukid ōji é uma adaptação animada da história em quadrinhos de tolhido manda , na qual um mundo dividido entre o reino dos humanos e o reino dos demônios aguarda a chegada do superman , um monstro lendário que deveria unir os dois reinos .  ",objetiva
2392,de onde eles se inspiraram e o que há nesse estilo que está se tornando cada vez mais popular na indústria cultural ? ,objetiva
2393," no inverno de number , um grupo de jovens caminhantes não voltou de uma passagem nas montanhas .  ",objetiva
2394," as histórias de contos de fadas de três amigos inseparáveis ​​ - os leitões figura , fofo e branca de neve são cheias de humor , exagero e sagacidade .  ",objetiva
2395," ele começa a trabalhar como assistente do juiz local , onde é testemunha diária dos horrores dos julgamentos políticos .  ",objetiva
2396,sua facilidade natural e aparente descuido são apenas uma máscara para sua solidão . ,objetiva
2397," babador está na casa dos trinta e ganha a vida como diretor , mas em sua vida profissional até agora só fez comerciais e filmes baratos para televisão , principalmente inspirados em canções folclóricas .  ",objetiva
2398," há imagens de assassinatos , guerrilhas insurgentes ou soldados americanos se divertindo .  ",objetiva
2399,el és devem unir forças contra um inimigo comum para encontrar o caminho de volta para casa do inferno e impedir que o passado se repita . ,objetiva
2400," além de um ufo inteligente , ele tem que lidar com um programa de computador com defeito e uma ' bomba inteligente ' que se considera deus .  ",objetiva
2401," el és tentam se refugiar aqui da polícia , que os procura por assassinato .  ",objetiva
2402,mark insurge é um talentoso pintor que sofre de depressão constante . ,objetiva
2403,forças especiais estão expostas a reações nucleares e explosões neste polígono . ,objetiva
2404," enquanto finta é um atirador de elite , o brasil é bom com uma faca .  ",objetiva
2405,uma história de detetive áspera e complexa de uma pequena cidade no norte da romênia . ,objetiva
2406," você não quer morrer , mas ao mesmo tempo está fugindo da vida .  ",objetiva
2407," um micro-ondas agora faz parte da maioria dos lares , mas e se , em vez de um utensílio de cozinha clássico , se tornar uma coisa intocada que está sempre com fome e faz você querer matar por isso ?  ",objetiva
2408," além disso , ele pode escapar de seu pai dominador , que administra um açougue colher e sofre de sentimentos perturbados de medo .  ",objetiva
2409," de és de então , inúmeros filmes de tirar o fôlego foram feitos sobre esse tema , mas apenas um foi o primeiro na república tcheca , e esse é o documentário vela a bile a aza gansa  ",objetiva
2410," a lendária ponte perto de banhem , na holanda , permaneceu nas mãos dos alemães por muito tempo .  ",objetiva
2411,nino mandarei em sete histórias sobre os misteriosos cantos do amor e da sexualidade . ,objetiva
2412,os mortos começaram a acordar na cidade e duas famílias estão tentando sobreviver a uma noite terrível no início do apocalipse zumbi . ,objetiva
2413," ao longo do caminho , eles param para comprar refrescos em um posto de gasolina , onde o olhar de kevin encontra o de um desconhecido misterioso e de aparência estranha .  ",objetiva
2414," “ e se esse pedaço de couro for realmente mágico , você concorda com meus termos ?  ",objetiva
2415,o cantor e compositor e colunista jane buiria decidiu criar seu novo álbum baseado em um conceito original . ,objetiva
2416,el és realmente não sabem o que exatamente os mantém juntos . ,objetiva
2417,aja tornou-se um exemplo brilhante de integração na sociedade francesa . ,objetiva
2418," mais tarde é revelado que os peregrinos negros colocaram uma esfera roxa semelhante na terra no passado , com a intenção de explodir no momento em que sua nave se aproximasse do planeta novamente .  ",objetiva
2419," o menino revela seu segredo ao diretor , que promete protegê-lo não importa o que aconteça .  ",objetiva
2420,isso significa que o assassino dela ainda está à solta ? ,objetiva
2421,o cruel general estava esperando por esse momento há muito tempo para se vingar dos americanos . ,objetiva
2422," a comédia negra de proporções trágicas , ou banguela , não muda .  ",objetiva
2423,e em é um mestre na dança da música pop coreana . ,objetiva
2424," his dark essence , uma adaptação em série da premiada trilogia de mesmo nome do escritor philip suíço , considerada uma obra-prima moderna da ficção imaginativa , segue lyra ( dafne grace ) , uma jovem aparentemente comum , mas corajosa , de outro mundo .  ",objetiva
2425," fuja da realidade da agitação diária para o deserto canadense com me . vá uta , aza . poda disk e ver . vidra .  ",objetiva
2426," o esforço pioneiro para promover seu trabalho foi realizado no palco coopera no hole bobice de praga ( antigo teatro milênio e teatro metropolitano ) , onde a televisão tcheca também filmou uma gravação de sua ópera dispus tiranas .  ",objetiva
2427,on de os castores têm paus duros . ,objetiva
2428," a primavera chegou ao jellyston park : é a época das flores , pássaros , abelhas e , o melhor de tudo , me a bel a e seu grande parceiro buiu acabaram de acordar da hibernação .  ",objetiva
2429," porque senão , o ano zero logo estará aqui para a cidade dos anjos !  ",objetiva
2430,ele é arrastado para toledo e julgado pelos outros frades por desobediência . ,objetiva
2431,o terceiro filme do promissor jovem diretor e roteirista hal hartley também é baseado em suas próprias experiências de estudos universitários de roteiro . ,objetiva
2432," quando você pensa na ' pradaria norte-americana ' , a maioria de nós pensa em uma longa estrada sem fim que se estende muito além do horizonte .  ",objetiva
2433,tornou - se fundador e diretor do centro de estudos teóricos e editor-chefe da revista vestir . ,objetiva
2434,cerimonia de encerramento do number terceiro ano do evento dedicado às mulheres idosas . ,objetiva
2435," bruno , esperando que seja um thriller político comum , aos poucos descobre que é na verdade a história de vida de silvio berlusconi .  ",objetiva
2436," filmagens projeta dramas pessoais na quietude da natureza , como a imagem de árvores caindo , que marcam um espaço de ansiedade e tristeza , uma lacuna depois de um ente querido que está desaparecido .  ",objetiva
2437," com sua ajuda , ele consegue uma linda princesa , mas nem tudo é tão bom quanto parece .  ",objetiva
2438," ele utilizou textos autênticos de sade e marat e assim criou uma espécie de colagem teatral , ilustrando a discussão filosófica dos dois protagonistas .  ",objetiva
2439," aqui , o pombo é o motivo da liberdade que o personagem principal anseia e ao mesmo tempo o amor que ele expressa através de sua lealdade ao criador .  ",objetiva
2440,sua inocência só foi provada após number longos anos de luta pela sobrevivência na prisão . ,objetiva
2441, o filme da oficina da chamada brigona school conta a história de um homem que está tão absorto na leitura de uma ' história interessante ' que se esquece completamente de perceber o mundo ao seu redor .  ,objetiva
2442,um acidente de carro na estrada à noite e um confronto com uma gangue de capangas que assassinam sua namorada e o aleijam para sempre . ,objetiva
2443,mas o sucesso e a riqueza nunca são gratuitos . ,objetiva
2444," é um momento cruel para o coração vaidoso do ex-comandante dos exércitos imperiais , tu'an tratorista .  ",objetiva
2445," no entanto , a próxima guerra preparou um destino trágico para ele .  ",objetiva
2446," além do mais - o assassino se apropriou da identidade de brian , sob a qual ele começou a realizar um novo ' trabalho ' .  ",objetiva
2447,as questões básicas discutidas na versão cinematográfica do conto são a ilusão da fusão de culturas e a impossibilidade de tradução . ,objetiva
2448,ele logo terá que aceitar o quão chata sua própria existência é comparada à vida feliz dela . ,objetiva
2449,um novo ponto quente para desastres de titanossauro em um lugar onde você definitivamente não esperaria . ,objetiva
2450," por se assemelhar a escamas de peixe , as pessoas o chamam de peixe .  ",objetiva
2451,de és en vôos animados soviéticos sobre o confronto de dois onze de futebol de brinquedo . ,objetiva
2452,um padre iria tão longe a ponto de sequestrar ou ter uma criança inocente sequestrada por isso ? ,objetiva
2453,que consequências isso poderia ter para todo o reino ? ,objetiva
2454," graças a um certo truque de mágica , nossos heróis podem viajar para um universo estranho para recuperar a coroa roubada de crystal hill .  ",objetiva
2455,o diretor sente que algo está faltando em sua vida segura de classe média . ,objetiva
2456,jeremy e melissa se apaixonam e não conseguem controlar seus sentimentos . ,objetiva
2457,a floresta torna-se sua companheira e consoladora . ,objetiva
2458," no entanto , tanto ela quanto os servos afirmam que não conhecem paulo e nunca ouviram falar dele em suas vidas .  ",objetiva
2459," juntam en te com outras mulheres da aldeia , ela planta árvores , colhe ervas daninhas , queima lenha e recolhe pinhas .  ",objetiva
2460,é apenas mais um treino ou algo mais ? ,objetiva
2461,o jovem agatha deve reverter esse destino . ,objetiva
2462," no entanto , casando-a escapa , rudolph é morto em um tiroteio .  ",objetiva
2463," árias famosas e populares , cenas corais , prelúdios , polcas e outras composições de bed bicha metano são tocadas pela orquestra sinfônica da rádio tcheca com o maestro ver . vale .  ",objetiva
2464,joy é interpretada pelas comediantes susie esma e serrei winchester . ,objetiva
2465,uma linda e saudável menina nasceu de uma mãe italiana . ,objetiva
2466," frustrada com a imprevisibilidade da vida , ela decide aplicar princípios científicos à sua vida amorosa até agora .  ",objetiva
2467,mas em breve algo acontecerá que mudará sua visão entusiástica . ,objetiva
2468," com a ajuda do professor da turma e de outros colegas , ela consegue essa difícil tarefa .  ",objetiva
2469," como muitos de seus pacientes , ele sofre de uma paixão obstinada .  ",objetiva
2470," um filme infantil fofo e digno de seu tempo , principalmente pela qualidade do set .  ",objetiva
2471," no canadá , o menino se aproxima de roland , capitão de um navio de cruzeiro local , que gosta da prima de homem , safira .  ",objetiva
2472," a heroína é uma menina judia que sobreviveu aos campos de concentração , mas permaneceu sozinha no mundo - nenhum de seus parentes e amigos sobreviveu .  ",objetiva
2473," músicos chegam , convidando outros tecelões que tocam na banda de mene para a celebração do number terceiro de maio .  ",objetiva
2474,vote na nova competição para a melhor base checa ! ,objetiva
2475,o fim viria quando as pessoas perdessem a esperança de algo melhor . ,objetiva
2476,o médico é constantemente distraído por mães chorosas que tentam atraí-lo para longe da cama do outro . ,objetiva
2477,roy não tem dúvidas de que a estrela vai aceitá-los e acha que mesmo não vai resistir ao seu charme viril . ,objetiva
2478," já três meses após seu estabelecimento , os primeiros leões foram trazidos para cá , vindo de um safári falido perto de viena .  ",objetiva
2479," mas tudo isso vai mudar agora , quando o casal descobrir a magia da fotografia .  ",objetiva
2480," ajudava se apresentou duas vezes na república tcheca : em number de outubro de number , ele deu um concerto no ice on a string hall em bremen e em number de outubro de number , no comedy hall em praga .  ",objetiva
2481," há vinte anos , eles competem entre si por qual deles terá mais poder , mais influência nos círculos mais altos de washington .  ",objetiva
2482," depois de number de setembro de number , a luta contra o terrorismo também se tornou a tarefa número um para ela .  ",objetiva
2483," após a derrota dos conspiradores , a gestapo prendeu number pessoas , das quais , principalmente com base nos veredictos de tribunais populares especiais , quase number pessoas foram executadas e muitas outras morreram em campos de concentração .  ",objetiva
2484," ele entra na cabine , mas o telefone não mostra sinais de funcionamento , então ele se vira e quer sair .  ",objetiva
2485," o protagonista da história cumpre van weekend ( herbert parkinson ) é um crítico literário que sobreviveu a um naufrágio no oceano e que cai sob o domínio de wolf karen ( michigan bosworth ) , um poderoso e amoral capitão do mar que o resgata .  ",objetiva
2486," os autores do documentário enquadram seu enredo com um trecho de uma peça teatral esquecida e nunca apresentada escrita para o teatro romper por jane aplica a , escritor e autor do romance ' the witch's hammer ' .  ",objetiva
2487," é impossível para eles se integrarem na sociedade francesa sem se deformarem , intelectual e fisicamente .  ",objetiva
2488," o papel principal de olivia foi interpretado por marie-claire olivia , que atuou em apenas três filmes , enquanto uma das principais estrelas do cinema francês , redige feuillère , indicada ao estatueta por sua criação , brilhou como diretora .  ",objetiva
2489," a história começa em number , quando a índia e o paquistão mobilizaram centenas de milhares de soldados em sua fronteira compartilhada após o ataque ao parlamento em deli ( de lembro de number ) e outros distúrbios .  ",objetiva
2490,eis en stein cria o enredo principalmente por meio de imagens e não usa nenhum personagem principal . ,objetiva
2491,taylor diz a ela que a guarda costeira estará com eles em uma hora e que ele enviará duas bombas aéreas . ,objetiva
2492," este belo salão com um passado rico ( uma vez um cabaré luxuoso , depois um cinema e agora um bingo sem muito sucesso ) está ameaçado de demolição .  ",objetiva
2493,o filme estreou em number de maio de number . ,objetiva
2494," a equipe paranormal baixada decidiu realizar uma extensa investigação neste local , que se estende não apenas ao local , mas também ao tempo .  ",objetiva
2495," a batalha acontecerá na terra , não no espaço , e os caçadores , os lagartos de lodo ou talvez os humanos sobreviverão ?  ",objetiva
2496," nos papéis vocalmente exigentes de jean valerá , augustin alfaia ou abre faria , ele mais uma vez provou suas habilidades de canto .  ",objetiva
2497,ou descubra por que uma xilogravura de um peixe em um prédio do governo de massachusetts estava no centro de um misterioso sequestro . ,objetiva
2498," boston , portanto , decide deixá-la por uma mulher do exótico ( ficcional ) paquistão que é treinada na arte de ' agradar homens ' .  ",objetiva
2499,histórias do ursinho e seus amigos . ,objetiva
2500," a amante do professor , a bela femme fatal giorgio ( rosana modesta ) , também pertence à festa .  ",objetiva
2501," o detetive aceita o caso e inicia uma investigação , durante a qual aos poucos descobre que não foi um acidente de carro comum , mas que realmente poderia ter sido um assassinato .  ",objetiva
2502," tudo isso , por exemplo , pode ser um espaço que muitas vezes nem percebemos , ou que para nós é na maioria das vezes apenas um ambiente que simplesmente temos que ir .  ",objetiva
2503," depois que uma tragédia familiar abala sua vida , ela encontra forças para enfrentar a realidade de uma maneira que não fazia ideia .  ",objetiva
2504," para evitar a captura , eles se juntam aos lendários voluntários do texas de sam houston .  ",objetiva
2505," antonio , tão velho que ' sim és sim en está dias parecem uma eternidade ' , aguarda a visita do filho na aconchegante casa de campo , que sabe que o pai pode não estar entre os vivos por muito mais tempo .  ",objetiva
2506,uma breve investigação sobre a vida dos trabalhadores sem-teto que estão esperando sua próxima oportunidade de trabalho no albergue . ,objetiva
2507," o coração de mais de um menino de repente se acenderá para ela , e o número de pessoas interessadas em aulas particulares de francês está crescendo diametralmente .  ",objetiva
2508," the lota é um remake americano do thriller belga de mesmo nome de number , com clayton van loo dirigindo desta vez também .  ",objetiva
2509," quando ele foi condenado à prisão , sua mãe pensou que ele não sobreviveria à ' vergonha ' .  ",objetiva
2510,o crepitar da lenha na lareira o acalma ? ,objetiva
2511,este trem foi nomeado o festival express . ,objetiva
2512,carros lendários através dos olhos do importante jornalista e piloto tcheco jacuba refle . ,objetiva
2513," final en te , woody allen mostrará ao público como é ter esperma disparado em ação a partir do centro de controle do cérebro de um homem excitado .  ",objetiva
2514," a peça fornece uma expressão musical e dramaticamente convincente do enredo da balada , a paixão de ledora e sua dor comovente , bem como o poder destrutivo apaixonado de filem .  ",objetiva
2515," tudo fica pior quando eles caem nas garras de evola , o delfo , e sua gangue , que estão tentando destruir o natal .  ",objetiva
2516," um padre americano , religioso , chega como emissário da sé apostólica à ilha irlandesa , onde tem a tarefa de impedir a celebração da santa missa no rito tradicional latino .  ",objetiva
2517," os fantasmas do passado se entrelaçam com a atmosfera sombria do hospital , mas o mundo interior do herói é muito mais interessante do que a realidade circundante .  ",objetiva
2518,seus filhos também não estão indo muito bem nos relacionamentos . ,objetiva
2519,há longas conversas banais sobre dinheiro e vida . ,objetiva
2520," o próprio heyerdahl filmou todo o curso da expedição em detalhes , e este documentário dele mais tarde se tornou um vencedor do oscar em number , a versão em livro vendeu mais de number milhões de cópias em todo o mundo e foi traduzida para mais de number idiomas .  ",objetiva
2521,no ciclo - os anos voam para os anjos - são escolhidas personalidades portadoras de sabedoria e ricas experiências de vida e que foram na sua maioria perseguidas por regimes totalitários e de certa forma também enriquecidas por esta cruz . ,objetiva
2522," nas notícias que tocam no rádio do carro , os moradores são avisados ​​ de um sádico que escapou recentemente , conhecido por sua fraqueza por mulheres jovens .  ",objetiva
2523," além disso , tudo na fazenda não é tão idílico quanto parece à primeira vista .  ",objetiva
2524,mas ele teria que fazer algo para limpar sua ficha criminal ; ,objetiva
2525,aconteceu há sessenta anos . ,objetiva
2526," el és são ricos , muitas vezes famosos e influentes .  ",objetiva
