,FRASE,OBJ/SUBJ
3419," em uma viagem que nos mostrará a beleza de momentos individuais da vida humana , a mesquinhez dos outros , o humor e a tragédia escondidos dentro de cada um de nós , a majestade da vida e as fraquezas humanas .  ",objetiva
3420," aqui , nossa equipe de especialistas em mergulho e conservação de tubarões está arriscando suas vidas para nadar livremente com tubarões para determinar o que é mito e o que é realidade .  ",objetiva
3421,yin finalmente tem a chance de mostrar suas habilidades de luta . ,objetiva
3422," a heroína da comédia francesa de didier caron é odette , cuja filha margo está prestes a se casar .  ",objetiva
3423,janine e seus dois amigos terão dificuldade em encontrar o dispositivo desejado na paisagem nevada nórdica durante a noite . ,objetiva
3424," um thriller policial bastante sombrio de quebec , um pouco cômico .  ",objetiva
3425,as cidades permanecem não ditas porque as palavras não são o principal meio pelo qual os aborígenes se comunicam uns com os outros . ,objetiva
3426," um inspetor de polícia chega à casa , que pretende reconstruir o assassinato e revelar o assassino .  ",objetiva
3427," evoco és inesperadas surgem entre os casais , resultando em uma dramática viagem de barco .  ",objetiva
3428," depois que eivando retorna da terra santa , ele descobre que o rei ricardo coração de leão está preso no ducado da áustria .  ",objetiva
3429," gonzalo , que é infértil , fica sabendo por sua ' nova ' esposa que ela está grávida .  ",objetiva
3430," mas agora ela precisa encontrar o pai biológico de ray , que deve assinar um consentimento para mudá-lo .  ",objetiva
3431,um bebê é primeiro cuidado por seus pais . ,objetiva
3432," uma noite animada sobre bugia , o mensageiro dos sonhos .  ",objetiva
3433," nas composições dos antigos mestres tchecos na igreja de st . havel co-apresenta : coro infantil de john , maestro já . cavala , orquestra sinfônica tcheca . estação de rádio em praga , maestro ver . vale .  ",objetiva
3434," sua família assegurou-lhe que ela nunca poderia fazer nada , mas ela inesperadamente encontra sua vocação como enfermeira em um lar de idosos em liverpool .  ",objetiva
3435,mas mesmo o uso da linguagem de sinais ao olhar para as belezas na abertura tem suas armadilhas . ,objetiva
3436," dez anos depois de um grupo de estudantes do ensino médio matar acidentalmente um menino e encobrir seu ato , ex-amigos são assassinados um a um .  ",objetiva
3437,esta teoria foi formulada há mais de cento e cinquenta anos por charles darwin . ,objetiva
3438," o filme non-parent mostra seis histórias diferentes , seis visões sobre frontalidade e com elas seis formas diferentes de famílias .  ",objetiva
3439," essa és três compartilham um sonho comum e embarcam em uma jornada de amor , ódio e confiança juntos .  ",objetiva
3440," não apenas encontraremos um vau com o nome de cachorros molhados , mas também passaremos sob a misteriosa e muito perigosa rocha da bruxa jazi para descobrir onde estavam localizados seu castelo e túmulo , sobre o qual o cronista gosmas escreve .  ",objetiva
3441,um homem marca um encontro com uma jovem por telefone . ,objetiva
3442,escrever sobre como o ícone do cinema francês ainda está bonito seria carregar lenha para a floresta . ,objetiva
3443," a tragédia não demora a chegar quando chuvas torrenciais atingem sua área e as filhas de frank , iris e rose , são forçadas a assumir responsabilidades que não são normais para sua família .  ",objetiva
3444,jam és escapa em um carro com uma equipe inconsciente da fotógrafa senhora . gertrude ( joan bennett ) e sua modelo susan willis ( anda hendrix ) . ,objetiva
3445,a história da pantomima de jogo bureau ao teatro físico contemporâneo . ,objetiva
3446," em contraste com a pacífica composição melódica do músico sul-coreano peleja , há até um acompanhamento visual de terror .  ",objetiva
3447," são lugares escuros e escondidos - casas , santuários , estradas , aquedutos - cada um associado a maravilhas e dificuldades .  ",objetiva
3448," com seu último suspiro , o chefe moribundo transfere sua alma maligna para o corpo de chase .  ",objetiva
3449,ele fuma um maço inteiro de cigarros naquele dia . ,objetiva
3450," um dos diretores contemporâneos mais proeminentes , robert sê-la reik , está pensando nisso .  ",objetiva
3451," el és enfrentarão extremo isolamento e pressão psicológica , sozinhos e juntos , enquanto se aventuram no desconhecido e documentam suas próprias experiências .  ",objetiva
3452," segundo o lema ' inter arma silent musa ' ( quando os canhões chocalham , as musas se calam ) , era um momento pouco propício para a apresentação de uma nova obra musicalmente dramática , que se tornaria um pilar fundamental da nossa cultura nacional .  ",objetiva
3453,cai suga alai é um maníaco preguiçoso que não quer nada além de dinheiro e uma vida de luxo . ,objetiva
3454," o filme na divo captura a performance no meio de uma peregrinação abandonada , que o ciro la puta desperta para uma nova vida com a alegria de poder representar novamente .  ",objetiva
3455," uma fascinante visão dos bastidores do planejamento de viagens de uma das pessoas mais poderosas do planeta , incluindo segurança , gerenciamento de multidões , viagens aéreas e uma carreata de number carros .  ",objetiva
3456," chuck se esconde no planetário , onde o nativo de dezesseis anos alemã trabalha como temporário .  ",objetiva
3457," no entanto , a jovem ainda se sente culpada e pede desculpas por quebrar as regras até que a última gota finalmente quebra as travas no ar de ambos os lados .  ",objetiva
3458," algumas das fotos são simplesmente de tirar o fôlego , algumas delas são absolutamente bizarras .  ",objetiva
3459," uma história sobre como a vida deve ser vivida , cheia de belas mulheres e carros , mas também um testemunho contemporâneo da deriva da família tradicional italiana em direção ao individualismo e ao consumismo .  ",objetiva
3460,adocem en etário sobre o filme de ação e aventura tomb raider estrelado por alicia lange . ,objetiva
3461," embora o encontro não tenha sido muito romântico , joanetes se apaixonou à primeira vista .  ",objetiva
3462," as propriedades tchecas iniciaram uma resistência armada contra a monarquia dos habsburgos , à qual gradualmente se juntaram protestantes de muitos países europeus .  ",objetiva
3463," por todos os membros da família se adaptarem e aceitarem um tipo diferente de comunicação uns com os outros como uma parte natural da vida , eles permitiram que tobias se visse como surdo e , assim , desenvolvesse plenamente sua identidade .  ",objetiva
3464," hoje , eles têm dois filhos juntos , michael , de onze anos , e susan , de seis , ambos com bons empregos , são bonitos , bem-sucedidos e acabaram de se mudar para uma casa maior .  ",objetiva
3465,vamos reunir os melhores jogadores do passado com as maiores estrelas da atualidade e finalmente descobrir de uma vez por todas quem é o melhor de todos . ,objetiva
3466,anato não tem nenhuma lembrança de seu marido . ,objetiva
3467,e ele espera que as pessoas que passam entendam o significado de suas ações . ,objetiva
3468," jovem e bem-sucedido , além disso , firmemente ancorado no atual establishment sócio-político .  ",objetiva
3469,a primeira coisa que lhe vem à mente é fazer um grande trabalho . ,objetiva
3470," na região de loes glaciar da china , que cobre number quilômetros quadrados , liu conhece john clayton , o designer e criador do projeto de puericultura .  ",objetiva
3471," cam concorda em cuidar de suas filhas corajosas , o que logo passa por cima de sua cabeça .  ",objetiva
3472," um deles mata por prazer , o outro vende os órgãos vitais dos mortos no mercado negro .  ",objetiva
3473," uma extraordinária mistura de cores e aromas em um canto único das pequenas antilhas . são bartolomeu , em homenagem ao irmão de cristóvão colombo , fica a cerca de vinte quilômetros da ilha de são cristóvão e é surpreendentemente diferente de seu grande vizinho .  ",objetiva
3474," luther wing entra em conflito com mr . ko , o mestre da escola dos cinco dragões .  ",objetiva
3475,e suas últimas aventuras são muito influenciadas pelas notas criptografadas que tom gizar mantinha em seu diário secreto - um diário que honda descobriu no outono de number . ,objetiva
3476,ela entremeou a gravação de uma bela tarde de verão no jardim entre as cabanas com memórias e registros de arquivo do ensaio geral da estreia mundial da ópera do mendigo em forni pô cérvice no ano totalitário de number . ,objetiva
3477," nas condições do movimento de resistência clandestino , ele conseguiu salvar mais de mil crianças judias presas da liquidação de várias maneiras sutis .  ",objetiva
3478," morcegos voando sobre o cemitério , uma aranha , uma coruja , cães uivando , gatos silvando e até esqueletos saindo de covas .  ",objetiva
3479," a famosa performance teatral de dicado na revezou balada for the bandei , a história de ivan odebrecht sobre o lendário bandido da ucrânia transcarpática , walt bucha , inspirou o diretor vladimir morável a reintroduzida a performance em seu ambiente original e ganiu locai , em um lugar que continua a procurar a sua cara e relação com a europa .  ",objetiva
3480," quando seus curativos são removidos , é revelado que a reconstrução facial necessária resultou acidentalmente em uma bela morena .  ",objetiva
3481,um voto secular a obrigava a proteger os tesouros de seu reino . ,objetiva
3482," os diretores filmaram secretamente , registrando secretamente as reuniões das autoridades com os trabalhadores e confrontos com a polícia , despejos de apartamentos e marchas de grevistas .  ",objetiva
3483,berlim é uma cidade cosmopolita verde no coração da europa e um paraíso para muitas espécies de animais selvagens . ,objetiva
3484," e é por isso que os cinco detetives mais famosos da atualidade , entre os quais , apesar da mudança de nome , você certamente também reconhecerá phil malote , hercule poirot ou miss amarele , começam a fazer as malas e vão direto para a luxuosa residência do homem rico .  ",objetiva
3485," mas você não pode comandar o amor , especialmente de uma avó preocupada .  ",objetiva
3486," um grupo de amigos - natalie , brooke , taylor , alvin , quinn e laurel decidem ir a um parque de diversões e se divertir .  ",objetiva
3487," então , por que não ganhar algum dinheiro extra junto com seus colegas de quarto vendendo-os ?  ",objetiva
3488," um conto sobre como é importante ter seu homem-peixe , e também como superar uma maldição fatal e feitiços que são fáceis de abusar .  ",objetiva
3489," assim que herbie foi solto , ele começou a procurar cúmplices .  ",objetiva
3490,limitadora en te fomos o único casal a atravessar a desabitada península de hornstandir em março de number ! ,objetiva
3491," depois de assassinar seu pai , o jovem robin homo foge para a floresta de grant em busca de consolo e uma nova família .  ",objetiva
3492," a garota , que está feliz por ter escapado do maluco richard , aceita .  ",objetiva
3493," quando a ' de espedida de solteiro ' , o amigo e ator ricky ( michael richards ) e a bela garçonete billie se envolvem , de repente charlie não tem mais certeza de nada .  ",objetiva
3494," na vila suíça de caverne , os moradores não estão indo bem .  ",objetiva
3495," el és emboscam uma garota no distrito do pomar , mas ela consegue escapar .  ",objetiva
3496,será que brigitte conseguirá salvar sua irmã e reverter a antiga maldição ? ,objetiva
3497,o talentoso pianista americano july sofre uma lesão na mão pouco antes de uma importante competição internacional . ,objetiva
3498," el és conseguirão sobreviver à difícil missão com todas as suas armadilhas , que incluem os blood broncos , liderados pelo temido general von doará ?  ",objetiva
3499,alguns animais são particularmente sensíveis e podem detectar até mesmo as menores vibrações . ,objetiva
3500," o conceito sintonizado em documentário no estilo do cinema direto transmite imagens cativantes da vida cotidiana da time square cheias de banners brilhantes de cinemas brindou-se , ferros-velhos empoeirados , bufês gordurosos e bancas de jornal com revistas lascivas e literatura lixo com a mesma poética de midnight cowboy de schlesinger ( number ) .  ",objetiva
3501," ela é dona de casa , não tem amigos , exceto os amigos do marido .  ",objetiva
3502," para sobreviver , os dois homens também devem trabalhar juntos no deserto inóspito .  ",objetiva
3503," seus filhos adultos vêm visitar seus pais em roubai , no norte da frança , para celebrar o natal com suas famílias .  ",objetiva
3504," quando inove é brutalmente assassinado , hassel e seus colegas embarcam em uma missão para vingar inove .  ",objetiva
3505,dê uma olhada em seus melhores eventos com meninos e meninas ! ,objetiva
3506," no início , havia um grande amor romântico , tanto que levou sara de sua alemanha natal até a américa quando era jovem .  ",objetiva
3507," as imagens incluídas no programa serão transmitidas a partir de number de fevereiro de number , no décimo terceiro dia do mês , no canal night of cave .  ",objetiva
3508,a evidência os leva ao apartamento onde os terroristas estão escondidos . ,objetiva
3509," no entanto , ele perde o emprego após uma liberação bêbada dos animais .  ",objetiva
3510," portanto , resta apenas uma opção : montar dois carros em um .  ",objetiva
3511," o oficial de investigação john marshall ( jim gertrude ) , que está lutando com uma crise conjugal , cuidando de um pai doente e viciado em álcool , tenta resolver o caso o mais rápido possível sob a pressão de um público descontente , e ao mesmo tempo quer provar que o assassino é um homem de carne e osso e não um espectro mítico .  ",objetiva
3512,isso porque o velho te . george maxwell ( bill herr ) tem sua própria fábrica de refrigerantes aqui e sabe como lidar com todos os agentes da coca-cola . ,objetiva
7140, exceto talvez por fuji mina ( como giza já mencionou apropriadamente - ' aquele amigo de todos abi ' :) ) todos foram simpáticos comigo em seus papéis .  ,subjetiva
7141," este filme não pode ser classificado em nenhum lugar , como se formasse seu próprio gênero único .  ",subjetiva
7142,som en te nesta série o relacionamento do doutor e rose finalmente ficará claro . ,subjetiva
7143," ah , e naquele dia naquele pub eles não tinham lombo ou goelas :( .  ",subjetiva
7144," para en a que a primeira meia hora , a maior parte da qual deveria ter permanecido no chão da sala de edição .  ",subjetiva
7145," há um pequeno problema com os novos personagens , que se você não os conhece dos quadrinhos , não saberá praticamente nada sobre eles .  ",subjetiva
7146," enga en heiro - linda garota , mas fora isso - terrível para . ( auto en sura )  ",subjetiva
7147," um filme com temática homossexual , onde o protagonista é harvey dimenstein , que primeiro trabalha como travesti em uma empresa e acaba chegando ao gerente de todo o show , em busca de um relacionamento perfeito , ele conhece mathews brodericka , que morre durante o filme , e harvey adota um menino problemático no final do filme , além dos problemas que ele tem no papel de pai , ele não tem paz nem mesmo no círculo familiar , onde constantemente briga com sua mãe .  ",subjetiva
7148," no próximo passo em sua carreira , ele foi parado por um bando de outros canalhas que enviaram bebia para a forca sem guardanapos alguns meses após a morte de stalin .  ",subjetiva
7149,eu senti que o filme estava tentando nos dizer como os muçulmanos são legais . ,subjetiva
7150,acho que o diretor conseguiu capturar fielmente a atmosfera da vida neste ambiente . ,subjetiva
7151," pois é , assim já vale os quatro ( dois ) .  ",subjetiva
7152,eu gostava mais dessa revista nos anos number . ,subjetiva
7153,fiquei ainda mais maravilhado . ,subjetiva
7154," a atmosfera simplesmente e simplesmente permanece , mesmo porque é propositalmente lançada em uma escuridão aterrorizante , até mesmo horrorosa , da qual toda uma geração de histórias de detetive se beneficia .  ",subjetiva
7155," até hoje , ainda não apaguei as cenas incrivelmente ásperas da minha cabeça , e provavelmente não vou .  ",subjetiva
7156," no começo parecia uma tática de tribunal bem pensada , mas depois de alguns momentos tornou-se um drama mais cheio de ação em que eu procurava por causas .  ",subjetiva
7157,a cena em que um cervo ( ou alguma forma pouco identificável de grande caça ) tem ramos de sakura florescendo em vez de chifres é . completamente descamante . ,subjetiva
7158," como resultado , um certo parecei recebeu number megabytes para adaptar seu roteiro muito bom , que pode mesclar várias tramas sem situações aleatórias e com personagens agindo de forma lógica e pragmática .  ",subjetiva
7159," e , finalmente , uma conclusão descuidada que arruinou completamente a impressão geral para mim .  ",subjetiva
7160," me és amor que eu pessoalmente não seja mais capaz de suportar barney , meus filhos amadureceram em algum momento entre number e number anos .  ",subjetiva
7161,sou fã do homem-aranha e estava ansioso por isso . ,subjetiva
7162," eu não esperava tanto do filme , mas tive menos do que meus sonhos mais loucos .  ",subjetiva
7163,ter caixas eletrônicos de mergulho é uma vergonha . ,subjetiva
7164," eu queria dar apenas três , porque o filme era tão apertado .  ",subjetiva
7165," no entanto , acho que os pandas de madagascar conseguiram o máximo possível , são cheios de ação , engraçados e menos loucos que seus colegas daquela ilha africana , o que atenderá a um público mais maduro , mas também será atraente o suficiente para as crianças e oferecer-lhes a lição de moral necessária e além disso . eles são muito fofos .  ",subjetiva
7166," my way , ou colme d'habitude , tornou calçola a mais famosa do mundo graças a sinatra , mas por outro lado , a versão de sinatra se tornou tão icônica que hoje apenas alguns ouvintes comuns lembram o nome do autor e intérprete original .  ",subjetiva
7167,é estranho quando a melhor experiência cinematográfica é uma música favorita . ,subjetiva
7168," deus , quando penso em todos aqueles momentos que quero chorar de novo , tão bem feito e muitas mensagens e cenas clássicas de bond , mal posso esperar pelo fim de semana para vê-lo novamente .  ",subjetiva
7169," aqui , os criadores jogaram no caldeirão do cenário : a ) terráqueos malignos do futuro que tentam impedir o domínio econômico japonês _ bom ) um lagarto pré-histórico da segunda guerra mundial , do qual gorila mais tarde será desenvolvido devido à radioatividade _ com ) o ano de number e a batalha de tropas americanas com japoneses em um das ilhas do pacífico _ de ) três macacos de pelúcia com asas de morcego que se transformam no dragão de três cabeças king guiadora após testes nucleares próximos _ e ) um mutante do futuro que sai de um carro em chamas levemente arranhado ( como em terminator ii ) e corre mais rápido que um carro de corrida _ fá ) um disco voador e não sei mais o que .  ",subjetiva
7170," o imperativo moral de uma predadora que procurava uma vítima completamente despreparada para ela , ao contrário , parecia-me muito distante da realidade .  ",subjetiva
7171,só dou três estrelas por causa de algumas boas fotos e um começo forte . ,subjetiva
7172," tudo bem , um pouco distorcido ( nunca pensei que ia rir de um alce digital excitado , mas aconteceu ) e houve alguns momentos constrangedores ( a morte de uma prostituta no evento - outra velhinha tirando de um colegial inexperiente nesta série ) , mas a ideia da restauração da bíblia é bastante sentimental , o que eu aceito .  ",subjetiva
7173," a última parte de tal padrão , como eu sei sobre merdas maiores .  ",subjetiva
7174,seja com locações reais ou com a abordagem profissional de não-atores do exército . ,subjetiva
7175," como muitos elogiam vesti afã como a melhor comédia tcheca , posso argumentar com muitas peças melhores e especialmente mais engraçadas de nossa rica cinematografia .  ",subjetiva
7176," no entanto , infelizmente , ambos riram de mim .  ",subjetiva
7177,acho alguns filmes tchecos completamente desnecessários . ,subjetiva
7178," além disso , ele é mais do que competentemente destacado por alexei serebryakov como o principal vilão e , surpreendentemente para mim , christopher lloyd , que eu realmente não esperava aqui e , como bob , sai um pouco de sua caixa usual .  ",subjetiva
7179," uma história linda e tocante sobre coragem , beleza interior de uma mulher e confiança em deus .  ",subjetiva
7180,um ataque absoluto a todos os sentidos . ,subjetiva
7181," no entanto , o humor japonês ( que ele também virou com king kong vs . gorila ) e o recorte da mitologia , explicações e esforços para construir uma narrativa mais complexa jogam paus sob os pés da série .  ",subjetiva
7182," qual foi um dos pontos das condições dos grevistas de fome para ter esse status revogado ,  ",subjetiva
7183,e você acha que a próxima versão americana vai passar sem essas cenas patéticas e brincando no fio da emoção ? ,subjetiva
7184,de és fruição perfeita apoiada por um elenco de qualidade ( és lei . ,subjetiva
7185," de alguma forma , não há ninguém para torcer e nada para pegar .  ",subjetiva
7186,o poder e a possibilidade de seu abuso é o alicerce de uma visão satírica da sociedade . ,subjetiva
7187," limitadora en te porque eu estava chorando como um bebê . sim , oceanos de lágrimas escorriam pelo meu rosto . especialmente o final do filme chegou até mim e eu pensei que ia desmaiar , mas eu não queria parar meu choro , eu queria continuar chorando e fiz . .  ",subjetiva
7188," rudolf del júnior . jogou especialmente bem . como atirador noha-ex - artista , radiosa brzobohat a ( intelectual e humanisticamente idealista , de outra forma muito bem lido cabo stanislav fodi afã ) e jia bina bohdalová no papel mais sério da animada dançarina de bar tona , que por sua performance bastante surpreendente e certamente valiosa ganhou o prêmio prêmio trilobita junto com o filme comédia com alça .  ",subjetiva
7189," precoce it os do desconhecido , barreiras culturais e fotos maravilhosas da eternamente chorosa londres , além de um super porco interpretado pela não-atriz nicole kidman .  ",subjetiva
7190," bem , nada , eu vi , vamos ver o que acontece a seguir .  ",subjetiva
7191," hoje , é um filme para quem o presenciou , que sempre o apreciará .  ",subjetiva
7192," não entendo por que ainda existe uma fantasia tão chata e sem graça sobre dragões , afinal não pode haver nenhum interesse nisso . quem se importaria com algo assim ?  ",subjetiva
7193," e devo dizer que , se algo assim acontecesse , eu ficaria feliz se as bolas caídas desse avô fossem uma inspiração natural .  ",subjetiva
7194,eu não sabia o que estava acontecendo o tempo todo . ,subjetiva
7195,isso definitivamente me faz pensar sobre a educação no futuro . ,subjetiva
7196," o filme segue o caminho do livro , porém , não penetra em profundidade , mas retrata relativamente bem os acontecimentos do povo da aldeia .  ",subjetiva
7197,o elenco vale a pena e todo mundo está falando como uma cabra . ,subjetiva
7198," o problema vem na segunda metade , que se arrasta por um tempo desnecessariamente longo , como se os criadores estivessem se perguntando como proceder .  ",subjetiva
7199,comédia louca que certamente encontrará muitos detratores . ,subjetiva
7200,eu tenho um jeito de cair na segunda categoria e é por isso que experimentei cada salto e cada obstáculo com eddie . ,subjetiva
7201," mau it os vão condenar cohen , porque seu humor não terá limites , mas eles mesmos riem todos os dias das comédias de tiras americanas excrementos e fodidas sem humor e uma pitada de invenção , mas com uma tonelada de merda de vários tipos .  ",subjetiva
7202,sim ! excelente :) realmente ótima experiência . ,subjetiva
7203," , coelho se envolve em tudo e sempre tem que ter tudo - > cocaína . , tigre não consegue ficar parado , sempre pula e mesmo assim nunca se cansa - > ecstasy . , pooh gosta de doces e tem uma grande imaginação - > cocaína .  ",subjetiva
7204,é apenas um velho blefe preto e branco que eu não quero ver de novo ! ,subjetiva
7205," eu até confiei naqueles caras para dividir o pãozinho , isso é o que eu chamo de camaradas !  ",subjetiva
7206," depois de barcos , outra grande série histórica que conta com um bom enredo , um roteiro elaborado , personagens simpáticos , bem desenvolvidos e , ao contrário do anterior , no realismo .  ",subjetiva
7207," eu não esperava o ponto final , considerando como cecília me afetou ao longo do filme , mas essa conclusão foi provavelmente uma das melhores opções .  ",subjetiva
7208," é chato , constrangedor , as duas primeiras partes são uma comédia decente , mas essa parte é uma porcaria absoluta .  ",subjetiva
7209," o comportamento ilógico dos personagens não é muito útil para fazer você gostar deles , e o final não soa como isso , porque é carregado no mesmo espírito soporífero do resto da hora e meia .  ",subjetiva
7210,outra foto dele me surpreendeu completamente e permanecerá na minha cabeça por muito tempo . ,subjetiva
7211," mas prefiro ser um espectador ' imparcial ' , ficarei muito feliz em perdoar o eventual papel ativo dos participantes ( em qualquer história ou realidade ) .  ",subjetiva
